ID,CODE,GROUP_CODE,SUB_GROUP_CODE,SECTION_CODE,OBJECT_CODE,TITLE,ACTIVE
14910,Ss_45_75,45,75,,,Piscine fauna systems,TRUE
14920,Ss_45_75_05,45,75,05,,Baffle fish pass systems,TRUE
14930,Ss_45_75_05_03,45,75,05,03,Alaskan A baffle fish pass systems,TRUE
14940,Ss_45_75_05_13,45,75,05,13,Chevron bottom baffle fish pass systems,TRUE
14950,Ss_45_75_05_35,45,75,05,35,Hurn-type baffle fish pass systems,TRUE
14960,Ss_45_75_05_46,45,75,05,46,Larinier super-active baffle fish pass systems,TRUE
14970,Ss_45_75_05_63,45,75,05,63,Plane baffle Denil fish pass systems,TRUE
14980,Ss_45_75_08,45,75,08,,Brush and bristle fish pass systems,TRUE
14990,Ss_45_75_08_13,45,75,08,13,Combined baffle-brush fish pass systems,TRUE
15000,Ss_45_75_08_16,45,75,08,16,Cylindrical bristle cluster brush fish pass systems,TRUE
15010,Ss_45_75_08_35,45,75,08,35,Hassinger brush-furnished fish pass systems,TRUE
15020,Ss_45_75_20,45,75,20,,Culvert fish pass systems,TRUE
15030,Ss_45_75_20_13,45,75,20,13,Corner baffle pipe culvert fish pass systems,TRUE
15040,Ss_45_75_20_16,45,75,20,16,Culvert brush fish pass systems,TRUE
15050,Ss_45_75_20_26,45,75,20,26,Embedded blockstone culvert fish pass systems,TRUE
15060,Ss_45_75_20_35,45,75,20,35,Horizontal slotted baffle culvert fish pass systems,TRUE
15070,Ss_45_75_20_55,45,75,20,55,Notch baffle pipe culvert fish pass systems,TRUE
15080,Ss_45_75_20_59,45,75,20,59,Offset baffle culvert fish pass systems,TRUE
15090,Ss_45_75_20_82,45,75,20,82,Spoiler baffle culvert fish pass systems,TRUE
15100,Ss_45_75_20_88,45,75,20,88,Triangular-crested baffle culvert fish pass systems,TRUE
15110,Ss_45_75_20_95,45,75,20,95,Weir baffle culvert fish pass systems,TRUE
15120,Ss_45_75_25,45,75,25,,Fish deterrent systems,TRUE
15130,Ss_45_75_25_05,45,75,25,05,Fish barrier systems,TRUE
15140,Ss_45_75_25_35,45,75,25,35,Fish guidance systems,TRUE
15150,Ss_45_75_26,45,75,26,,Elevator fish pass systems,TRUE
15160,Ss_45_75_26_10,45,75,26,10,Borland lift fish pass systems,TRUE
15170,Ss_45_75_26_30,45,75,26,30,Fish lock fish pass systems,TRUE
15180,Ss_45_75_26_80,45,75,26,80,Siphon fish pass systems,TRUE
15190,Ss_45_75_26_94,45,75,26,94,Venturi pump fish pass systems,TRUE
15200,Ss_45_75_30,45,75,30,,Flap gate and sluice fish pass systems,TRUE
15210,Ss_45_75_30_04,45,75,30,04,Automated gate fish pass systems,TRUE
15220,Ss_45_75_30_15,45,75,30,15,Counter-balanced gate fish pass systems,TRUE
15230,Ss_45_75_30_20,45,75,30,20,Damper and retarder fish pass systems,TRUE
15240,Ss_45_75_30_24,45,75,30,24,Duckbill valve fish pass systems,TRUE
15250,Ss_45_75_30_62,45,75,30,62,Petflap fish pass systems,TRUE
15260,Ss_45_75_30_76,45,75,30,76,Self-regulating gate fish pass systems,TRUE
15270,Ss_45_75_30_79,45,75,30,79,Side-hung gate fish pass systems,TRUE
15280,Ss_45_75_34,45,75,34,,Gravity eel pass systems,TRUE
15290,Ss_45_75_44,45,75,44,,Lamprey pass systems,TRUE
15300,Ss_45_75_55,45,75,55,,Nature-like fish pass systems,TRUE
15310,Ss_45_75_55_10,45,75,55,10,Bypass channel fish pass systems,TRUE
15320,Ss_45_75_55_15,45,75,55,15,Column bypass fish pass systems,TRUE
15330,Ss_45_75_55_72,45,75,55,72,Rock ramp fish pass systems,TRUE
15340,Ss_45_75_55_85,45,75,55,85,Sweep fish pass systems,TRUE
15350,Ss_45_75_60,45,75,60,,Pool fish pass systems,TRUE
15360,Ss_45_75_60_21,45,75,60,21,Deep notch and orifice pool fish pass systems,TRUE
15370,Ss_45_75_60_23,45,75,60,23,Deep notch no-orifice pool fish pass systems,TRUE
15380,Ss_45_75_60_40,45,75,60,40,Informal pool fish pass systems,TRUE
15390,Ss_45_75_60_65,45,75,60,65,Pool and orifice fish pass systems,TRUE
15400,Ss_45_75_60_67,45,75,60,67,Pool and traverse fish pass systems,TRUE
15410,Ss_45_75_60_69,45,75,60,69,Pre-barrage fish pass systems,TRUE
15420,Ss_45_75_60_77,45,75,60,77,Shallow V notch pool fish pass systems,TRUE
15430,Ss_45_75_60_94,45,75,60,94,Vertical slot pool fish pass systems,TRUE
15440,Ss_45_75_67,45,75,67,,Pumped eel pass systems,TRUE
15450,Ss_45_75_85,45,75,85,,Simple fish pass systems,TRUE
15460,Ss_45_75_85_10,45,75,85,10,Baulk fish pass systems,TRUE
15470,Ss_45_75_85_55,45,75,85,55,Notch fish pass systems,TRUE
15480,Ss_45_75_85_59,45,75,85,59,Orifice fish pass systems,TRUE
15490,Ss_45_75_85_69,45,75,85,69,Pre-obstacle bed modification fish pass systems,TRUE
15500,Ss_45_75_85_88,45,75,85,88,Slot fish pass systems,TRUE
15510,Ss_45_85,45,85,,,Artificial fauna systems,TRUE
15520,Ss_45_85_05,45,85,05,,Artificial fauna habitat systems,TRUE
15530,Ss_45_85_05_56,45,85,05,56,Artificial nesting platform systems,TRUE
15540,Ss_45_85_05_70,45,85,05,70,Artificial reef systems,TRUE
15550,Ss_50,50,,,,Disposal systems,TRUE
15560,Ss_50_10,50,10,,,Gas waste collection and distribution systems,TRUE
15570,Ss_50_10_45,50,10,45,,Landfill gas collection and distribution systems,TRUE
15580,Ss_50_10_95,50,10,95,,Waste gas collection and distribution systems,TRUE
15590,Ss_50_20,50,20,,,Non-aqueous liquid waste collection and distribution systems,TRUE
15600,Ss_50_20_45,50,20,45,,Landfill liquid collection and distribution systems,TRUE
15610,Ss_50_20_90,50,20,90,,Waste liquid fuel collection and distribution systems,TRUE
15620,Ss_50_20_95,50,20,95,,Waste process liquid collection and distribution systems,TRUE
15630,Ss_50_30,50,30,,,Above-ground drainage collection systems,TRUE
15640,Ss_50_30_02,50,30,02,,Rainwater drainage systems,TRUE
15650,Ss_50_30_02_28,50,30,02,28,External gravity rainwater drainage systems,TRUE
15660,Ss_50_30_02_40,50,30,02,40,Internal gravity rainwater drainage systems,TRUE
15670,Ss_50_30_02_65,50,30,02,65,Pressure-assisted full bore rainwater drainage systems,TRUE
15680,Ss_50_30_02_80,50,30,02,80,Siphonic full bore rainwater drainage systems,TRUE
15690,Ss_50_30_04,50,30,04,,Above-ground wastewater drainage systems,TRUE
15700,Ss_50_30_04_05,50,30,04,05,Basement wastewater drainage systems,TRUE
15710,Ss_50_30_04_15,50,30,04,15,Commercial catering wastewater drainage systems,TRUE
15720,Ss_50_30_04_95,50,30,04,95,Above-ground external stack wastewater drainage systems,TRUE
15730,Ss_50_30_04_97,50,30,04,97,Above-ground internal stack wastewater drainage systems,TRUE
15740,Ss_50_35,50,35,,,Surface and wastewater drainage collection systems,TRUE
15750,Ss_50_35_06,50,35,06,,Below-ground inspection systems,TRUE
15760,Ss_50_35_06_06,50,35,06,06,Brick manhole systems,TRUE
15770,Ss_50_35_06_08,50,35,06,08,Brick shallow inspection chamber systems,TRUE
15780,Ss_50_35_06_10,50,35,06,10,Brick shallow silt trap and flow control chamber systems,TRUE
15790,Ss_50_35_06_12,50,35,06,12,Concrete deep manhole systems,TRUE
15800,Ss_50_35_06_14,50,35,06,14,Concrete manhole systems,TRUE
15810,Ss_50_35_06_16,50,35,06,16,Concrete shallow inspection chamber systems,TRUE
15820,Ss_50_35_06_18,50,35,06,18,Concrete silt trap and flow control chamber systems,TRUE
15830,Ss_50_35_06_62,50,35,06,62,Plastics deep non-entry inspection chamber systems,TRUE
15840,Ss_50_35_06_64,50,35,06,64,Plastics distribution and sampling chamber systems,TRUE
15850,Ss_50_35_06_66,50,35,06,66,Plastics shallow inspection chamber systems,TRUE
15860,Ss_50_35_08,50,35,08,,Below-ground gravity drainage systems,TRUE
15870,Ss_50_35_08_15,50,35,08,15,Combined below-ground drainage pipeline systems,TRUE
15880,Ss_50_35_08_16,50,35,08,16,Combined sewer overflow systems,TRUE
15890,Ss_50_35_08_30,50,35,08,30,Foul wastewater below-ground drainage pipeline systems,TRUE
15900,Ss_50_35_08_85,50,35,08,85,Surface water below-ground drainage pipeline systems,TRUE
15910,Ss_50_35_10,50,35,10,,Below-ground pumped drainage systems,TRUE
15920,Ss_50_35_10_06,50,35,10,06,Below-ground package pumping station and pressure pipeline drainage systems,TRUE
15930,Ss_50_35_10_08,50,35,10,08,Below-ground pressure pipeline drainage systems,TRUE
15940,Ss_50_35_10_10,50,35,10,10,Below-ground pumping station drainage systems,TRUE
15950,Ss_50_35_45,50,35,45,,Land drainage systems,TRUE
15960,Ss_50_35_45_08,50,35,45,08,Blanket drain land drainage systems,TRUE
15970,Ss_50_35_45_20,50,35,45,20,Culvert land drainage systems,TRUE
15980,Ss_50_35_45_30,50,35,45,30,Filter drain land drainage systems,TRUE
15990,Ss_50_35_45_32,50,35,45,32,Fin drain land drainage systems,TRUE
16000,Ss_50_35_45_53,50,35,45,53,Mole and subsoiling drain land drainage systems,TRUE
16010,Ss_50_35_45_75,50,35,45,75,Slitting and grooving drain land drainage systems,TRUE
16020,Ss_50_35_45_85,50,35,45,85,Subsoil drainage pipe drain systems,TRUE
16030,Ss_50_35_45_90,50,35,45,90,Trenchless drain land drainage systems,TRUE
16040,Ss_50_35_65,50,35,65,,Pressure relief drainage systems,TRUE
16050,Ss_50_35_65_08,50,35,65,08,Blanket drain pressure relief systems,TRUE
16060,Ss_50_35_65_30,50,35,65,30,Filter drain pressure relief systems,TRUE
16070,Ss_50_35_65_35,50,35,65,35,Geocomposite sheet fin drain pressure relief systems,TRUE
16080,Ss_50_35_80,50,35,80,,Storm water gravity drainage systems,TRUE
16090,Ss_50_35_80_10,50,35,80,10,Bifurcation storm water overflow systems,TRUE
16100,Ss_50_35_80_72,50,35,80,72,Rigid attenuation or storage tank for storm water flood attenuation systems,TRUE
16110,Ss_50_35_82,50,35,82,,Surface and wastewater gravity drainage systems,TRUE
16120,Ss_50_35_82_41,50,35,82,41,Inlet drainage systems,TRUE
16130,Ss_50_35_82_59,50,35,82,59,Outlet drainage systems,TRUE
16140,Ss_50_35_82_73,50,35,82,73,Road drainage systems,TRUE
16150,Ss_50_40,50,40,,,Solid waste collection and distribution systems,TRUE
16160,Ss_50_40_95,50,40,95,,Waste collection systems,TRUE
16170,Ss_50_40_95_65,50,40,95,65,Pneumatic waste collection systems,TRUE
16180,Ss_50_50,50,50,,,"Gas waste storage, treatment and disposal systems",TRUE
16190,Ss_50_50_45,50,50,45,,Landfill gas disposal systems,TRUE
16200,Ss_50_50_95,50,50,95,,Waste gas treatment and disposal systems,TRUE
16210,Ss_50_60,50,60,,,"Non-aqueous liquid waste storage, treatment and disposal systems",TRUE
16220,Ss_50_60_45,50,60,45,,Landfill liquid disposal systems,TRUE
16230,Ss_50_60_90,50,60,90,,Waste liquid fuel storage and treatment systems,TRUE
16240,Ss_50_60_95,50,60,95,,Waste process liquid storage and treatment systems,TRUE
16250,Ss_50_70,50,70,,,"Drainage storage, treatment and disposal systems",TRUE
16260,Ss_50_70_05,50,70,05,,Below-ground drainage disposal systems,TRUE
16270,Ss_50_70_05_20,50,70,05,20,Below-ground drainage wastewater drainage field systems,TRUE
16280,Ss_50_70_05_22,50,70,05,22,Below-ground drainage foul wastewater grease separator and converter systems,TRUE
16290,Ss_50_70_05_23,50,70,05,23,Below-ground drainage septic tank systems,TRUE
16300,Ss_50_70_05_24,50,70,05,24,Below-ground drainage packaged sewage treatment systems,TRUE
16310,Ss_50_70_05_25,50,70,05,25,Below-ground drainage foul wastewater storage tank systems,TRUE
16320,Ss_50_70_05_79,50,70,05,79,Below-ground drainage concrete soakaway systems,TRUE
16330,Ss_50_70_05_80,50,70,05,80,Below-ground drainage granular fill soakaway systems,TRUE
16340,Ss_50_70_05_81,50,70,05,81,Below-ground drainage modular plastics attenuation or storage tank systems,TRUE
16350,Ss_50_70_05_82,50,70,05,82,Below-ground drainage modular plastics soakaway systems,TRUE
16360,Ss_50_70_05_83,50,70,05,83,Below-ground drainage oil and petrol separator systems,TRUE
16370,Ss_50_70_05_84,50,70,05,84,Below-ground drainage packaged silt trap systems,TRUE
16380,Ss_50_70_05_85,50,70,05,85,Below-ground drainage surface water storage tank systems,TRUE
16390,Ss_50_70_05_86,50,70,05,86,Below-ground drainage wet well systems,TRUE
16400,Ss_50_70_05_95,50,70,05,95,Below-ground drainage outfall systems,TRUE
16410,Ss_50_70_24,50,70,24,,Drainage disposal systems,TRUE
16420,Ss_50_70_24_80,50,70,24,80,Soakaway borehole systems,TRUE
16430,Ss_50_70_60,50,70,60,,Private drainage treatment systems,TRUE
16440,Ss_50_70_60_70,50,70,60,70,Radioactive wastewater treatment systems,TRUE
16450,Ss_50_70_83,50,70,83,,Surface water tank systems,TRUE
16460,Ss_50_70_85,50,70,85,,Sustainable drainage systems (SuDS),TRUE
16470,Ss_50_70_85_00,50,70,85,00,SuDS management train systems,TRUE
16480,Ss_50_70_85_06,50,70,85,06,Below-ground surface water storage tank systems,TRUE
16490,Ss_50_70_85_08,50,70,85,08,Bioretention area systems,TRUE
16500,Ss_50_70_85_15,50,70,85,15,Conveyance swale systems,TRUE
16510,Ss_50_70_85_21,50,70,85,21,Detention basin systems,TRUE
16520,Ss_50_70_85_24,50,70,85,24,Dry swale systems,TRUE
16530,Ss_50_70_85_30,50,70,85,30,Filter strip systems,TRUE
16540,Ss_50_70_85_31,50,70,85,31,Filter drain systems,TRUE
16550,Ss_50_70_85_32,50,70,85,32,Filtration and separation systems,TRUE
16560,Ss_50_70_85_33,50,70,85,33,Geocellular attenuation tank systems,TRUE
16570,Ss_50_70_85_34,50,70,85,34,Geocellular soakaway systems,TRUE
16580,Ss_50_70_85_35,50,70,85,35,Granular fill soakaway systems,TRUE
16590,Ss_50_70_85_41,50,70,85,41,Infiltration basin systems,TRUE
16600,Ss_50_70_85_42,50,70,85,42,Infiltration trench systems,TRUE
16610,Ss_50_70_85_58,50,70,85,58,Open channel conveyance systems,TRUE
16620,Ss_50_70_85_61,50,70,85,61,Pervious pavement systems,TRUE
16630,Ss_50_70_85_64,50,70,85,64,Pond systems,TRUE
16640,Ss_50_70_85_66,50,70,85,66,Precast concrete soakaway systems,TRUE
16650,Ss_50_70_85_70,50,70,85,70,Rainwater harvesting systems,TRUE
16660,Ss_50_70_85_75,50,70,85,75,Sand filter bed systems,TRUE
16670,Ss_50_70_85_76,50,70,85,76,Sand filter bed surface systems,TRUE
16680,Ss_50_70_85_85,50,70,85,85,Swale systems,TRUE
16690,Ss_50_70_85_96,50,70,85,96,Water butt systems,TRUE
16700,Ss_50_70_85_97,50,70,85,97,Wet swale systems,TRUE
16710,Ss_50_70_85_98,50,70,85,98,Wetland systems,TRUE
16720,Ss_50_75,50,75,,,"Wastewater storage, treatment and disposal systems",TRUE
16730,Ss_50_75_01,50,75,01,,Aeration systems,TRUE
16740,Ss_50_75_01_22,50,75,01,22,Diffused aeration systems,TRUE
16750,Ss_50_75_01_44,50,75,01,44,Jet aeration systems,TRUE
16760,Ss_50_75_01_51,50,75,01,51,Mechanical aeration systems,TRUE
16770,Ss_50_75_01_90,50,75,01,90,Tray cascade aeration systems,TRUE
16780,Ss_50_75_03,50,75,03,,Aquaculture disposal systems,TRUE
16790,Ss_50_75_03_21,50,75,03,21,Aquaculture degasser systems,TRUE
16800,Ss_50_75_03_23,50,75,03,23,Aquaculture discharge systems,TRUE
16810,Ss_50_75_03_80,50,75,03,80,Aquaculture sludge treatment systems,TRUE
16820,Ss_50_75_20,50,75,20,,Decanting systems,TRUE
16830,Ss_50_75_20_96,50,75,20,96,Wastewater decanting systems,TRUE
16840,Ss_50_75_21,50,75,21,,Desludging and sludge handling systems,TRUE
16850,Ss_50_75_21_75,50,75,21,75,Settlement tank gravity desludging systems,TRUE
16860,Ss_50_75_21_76,50,75,21,76,Sludge blanket settling wastewater systems,TRUE
16870,Ss_50_75_21_78,50,75,21,78,Sludge disposal systems,TRUE
16880,Ss_50_75_21_80,50,75,21,80,Sludge handling systems,TRUE
16890,Ss_50_75_21_82,50,75,21,82,Sludge treatment systems,TRUE
16900,Ss_50_75_21_96,50,75,21,96,Wastewater desludging systems,TRUE
16910,Ss_50_75_34,50,75,34,,Grit treatment and removal systems,TRUE
16920,Ss_50_75_34_16,50,75,34,16,Cross-flow grit removal systems,TRUE
16930,Ss_50_75_34_60,50,75,34,60,Package grit treatment and removal systems,TRUE
16940,Ss_50_75_34_94,50,75,34,94,Vortex grit removal systems,TRUE
16950,Ss_50_75_41,50,75,41,,Inlet works systems,TRUE
16960,Ss_50_75_41_15,50,75,41,15,Concrete inlet works systems,TRUE
16970,Ss_50_75_41_60,50,75,41,60,Package inlet works systems,TRUE
16980,Ss_50_75_41_66,50,75,41,66,Prefabricated inlet works systems,TRUE
16990,Ss_50_75_58,50,75,58,,Odour control systems,TRUE
17000,Ss_50_75_58_07,50,75,58,07,Biofiltration systems,TRUE
17010,Ss_50_75_58_08,50,75,58,08,Bio-scrubber systems,TRUE
17020,Ss_50_75_58_11,50,75,58,11,Catalytic iron filter systems,TRUE
17030,Ss_50_75_58_23,50,75,58,23,Dry installation systems,TRUE
17040,Ss_50_75_58_96,50,75,58,96,Wet scrubber systems,TRUE
17050,Ss_50_75_67,50,75,67,,Primary sewage treatment and final settlement systems,TRUE
17060,Ss_50_75_67_38,50,75,67,38,Horizontal flow tank systems,TRUE
17070,Ss_50_75_67_46,50,75,67,46,Lamella tank systems,TRUE
17080,Ss_50_75_67_70,50,75,67,70,Radial flow tank systems,TRUE
17090,Ss_50_75_75,50,75,75,,Scum removal systems,TRUE
17100,Ss_50_75_75_96,50,75,75,96,Wastewater scum removal systems,TRUE
17110,Ss_50_75_77,50,75,77,,Secondary sewage treatment systems,TRUE
17120,Ss_50_75_77_01,50,75,77,01,Activated sludge aeration tank systems,TRUE
17130,Ss_50_75_77_07,50,75,77,07,Biological filter tank systems,TRUE
17140,Ss_50_75_92,50,75,92,,Wastewater chemical dosing systems,TRUE
17150,Ss_50_75_92_13,50,75,92,13,Chemical dosing systems,TRUE
17160,Ss_50_75_93,50,75,93,,Wastewater filtration systems,TRUE
17170,Ss_50_75_93_02,50,75,93,02,Aggregate filtration systems,TRUE
17180,Ss_50_75_93_07,50,75,93,07,Biological percolating filter tiling systems,TRUE
17190,Ss_50_75_93_52,50,75,93,52,Membrane filtration systems,TRUE
17200,Ss_50_75_94,50,75,94,,Wastewater screenings handling systems,TRUE
17210,Ss_50_75_94_16,50,75,94,16,Combined screenings capture and handling systems,TRUE
17220,Ss_50_75_94_56,50,75,94,56,Non-powered screening systems,TRUE
17230,Ss_50_75_94_64,50,75,94,64,Powered screenings capture and handling systems,TRUE
17240,Ss_50_75_95,50,75,95,,Wastewater systems,TRUE
17250,Ss_50_75_95_67,50,75,95,67,Pumped wastewater systems,TRUE
17260,Ss_50_75_98,50,75,98,,Wastewater tank systems,TRUE
17270,Ss_50_75_98_96,50,75,98,96,Wastewater tank flushing systems,TRUE
17280,Ss_50_80,50,80,,,"Solid waste storage, treatment and disposal systems",TRUE
17290,Ss_50_80_40,50,80,40,,Incinerator systems,TRUE
17300,Ss_50_80_80,50,80,80,,Solid waste compacting systems,TRUE
17310,Ss_50_80_80_96,50,80,80,96,Waste compactor systems,TRUE
17320,Ss_50_80_82,50,80,82,,Solid waste sorting systems,TRUE
17330,Ss_50_80_96,50,80,96,,Weighbridge systems,TRUE
17340,Ss_50_80_96_00,50,80,96,00,Above-ground weighbridge systems,TRUE
17350,Ss_50_80_96_63,50,80,96,63,Pit weighbridge systems,TRUE
17360,Ss_50_95,50,95,,,Temporary disposal systems,TRUE
17370,Ss_55,55,,,,Piped supply systems,TRUE
17380,Ss_55_05,55,05,,,"Gas extraction, treatment and storage systems",TRUE
17390,Ss_55_05_30,55,05,30,,Gas extraction systems,TRUE
17400,Ss_55_05_75,55,05,75,,Gas storage tank systems,TRUE
17410,Ss_55_05_85,55,05,85,,Gas treatment systems,TRUE
17420,Ss_55_05_95,55,05,95,,Gas well systems,TRUE
17430,Ss_55_10,55,10,,,"Liquid fuel extraction, treatment and storage systems",TRUE
17440,Ss_55_10_70,55,10,70,,Liquid fuel extraction systems,TRUE
17450,Ss_55_10_75,55,10,75,,Liquid fuel storage tank systems,TRUE
17460,Ss_55_10_85,55,10,85,,Liquid fuel treatment systems,TRUE
17470,Ss_55_10_95,55,10,95,,Liquid fuel well systems,TRUE
17480,Ss_55_15,55,15,,,"Water extraction, treatment and storage systems",TRUE
17490,Ss_55_15_50,55,15,50,,Pre-oxidation water treatment systems,TRUE
17500,Ss_55_15_50_10,55,15,50,10,Chlorine dioxide pre-disinfection systems,TRUE
17510,Ss_55_15_50_12,55,15,50,12,Chlorine pre-disinfection systems,TRUE
17520,Ss_55_15_50_14,55,15,50,14,Chloroamine pre-disinfection systems,TRUE
17530,Ss_55_15_50_16,55,15,50,16,Coagulation systems,TRUE
17540,Ss_55_15_50_30,55,15,50,30,Flocculation systems,TRUE
17550,Ss_55_15_50_60,55,15,50,60,Ozone pre-disinfection systems,TRUE
17560,Ss_55_15_50_64,55,15,50,64,Potassium permanganate pre-disinfection systems,TRUE
17570,Ss_55_15_55,55,15,55,,Clarification water treatment systems,TRUE
17580,Ss_55_15_55_21,55,15,55,21,Desludging systems,TRUE
17590,Ss_55_15_55_23,55,15,55,23,Direct homogenous sand filtration systems,TRUE
17600,Ss_55_15_55_25,55,15,55,25,Direct twin and triple-layer filtration systems,TRUE
17610,Ss_55_15_55_30,55,15,55,30,Filtration systems,TRUE
17620,Ss_55_15_55_32,55,15,55,32,Flotation systems,TRUE
17630,Ss_55_15_55_46,55,15,55,46,Lamella plate settling systems,TRUE
17640,Ss_55_15_55_76,55,15,55,76,Sludge blanket settling systems,TRUE
17650,Ss_55_15_55_78,55,15,55,78,Sludge contact systems,TRUE
17660,Ss_55_15_55_80,55,15,55,80,Static settling systems,TRUE
17670,Ss_55_15_60,55,15,60,,Polishing water treatment systems,TRUE
17680,Ss_55_15_60_08,55,15,60,08,Biological filter systems,TRUE
17690,Ss_55_15_60_34,55,15,60,34,Granular activated carbon adsorption systems,TRUE
17700,Ss_55_15_60_60,55,15,60,60,Ozone oxidation systems,TRUE
17710,Ss_55_15_60_64,55,15,60,64,Powdered activated carbon adsorption systems,TRUE
17720,Ss_55_15_60_72,55,15,60,72,Resin adsorption systems,TRUE
17730,Ss_55_15_65,55,15,65,,Potable water storage tank systems,TRUE
17740,Ss_55_15_65_15,55,15,65,15,Concrete potable water storage systems,TRUE
17750,Ss_55_15_65_65,55,15,65,65,Plastics potable water storage systems,TRUE
17760,Ss_55_15_65_72,55,15,65,72,Reinforced concrete potable water storage systems,TRUE
17770,Ss_55_15_65_84,55,15,65,84,Steel framed potable water storage systems,TRUE
17780,Ss_55_15_72,55,15,72,,Water extraction and monitoring systems,TRUE
17790,Ss_55_15_72_20,55,15,72,20,Water extraction borehole systems,TRUE
17800,Ss_55_15_72_50,55,15,72,50,Water monitoring borehole systems,TRUE
17810,Ss_55_15_80,55,15,80,,Disinfection water treatment systems,TRUE
17820,Ss_55_15_80_10,55,15,80,10,Chlorine dioxide disinfection systems,TRUE
17830,Ss_55_15_80_12,55,15,80,12,Chlorine disinfection systems,TRUE
17840,Ss_55_15_80_14,55,15,80,14,Chloroamine disinfection systems,TRUE
17850,Ss_55_15_80_60,55,15,80,60,Ozone disinfection systems,TRUE
17860,Ss_55_15_80_90,55,15,80,90,Ultraviolet (UV) radiation disinfection systems,TRUE
17870,Ss_55_15_85,55,15,85,,Water treatment and purification systems,TRUE
17880,Ss_55_15_85_08,55,15,85,08,Biological aerated flooded filter systems,TRUE
17890,Ss_55_15_85_23,55,15,85,23,Dissolved air flotation systems,TRUE
17900,Ss_55_15_85_46,55,15,85,46,Lamella plate systems,TRUE
17910,Ss_55_15_85_75,55,15,85,75,Sandfilter systems,TRUE
17920,Ss_55_15_85_85,55,15,85,85,Submerged aerated filter systems,TRUE
17930,Ss_55_15_95,55,15,95,,Wet well systems,TRUE
17940,Ss_55_15_95_64,55,15,95,64,Piled wet well systems,TRUE
17950,Ss_55_15_95_72,55,15,95,72,Reinforced concrete wet well systems,TRUE
17960,Ss_55_20,55,20,,,Gas and vacuum distribution and supply systems,TRUE
17970,Ss_55_20_14,55,20,14,,Central vacuum systems,TRUE
17980,Ss_55_20_14_40,55,20,14,40,Industrial central vacuum systems,TRUE
17990,Ss_55_20_14_70,55,20,14,70,Residential central vacuum systems,TRUE
18000,Ss_55_20_33,55,20,33,,Gas distribution network systems,TRUE
18010,Ss_55_20_33_56,55,20,33,56,Natural gas distribution network systems,TRUE
18020,Ss_55_20_34,55,20,34,,Gas supply systems,TRUE
18030,Ss_55_20_34_05,55,20,34,05,Biogas supply systems,TRUE
18040,Ss_55_20_34_40,55,20,34,40,Incoming gas supply systems,TRUE
18050,Ss_55_20_34_46,55,20,34,46,Liquefied petroleum gas (LPG) supply systems,TRUE
18060,Ss_55_20_34_57,55,20,34,57,Natural gas supply systems,TRUE
18070,Ss_55_20_34_95,55,20,34,95,Welding gas supply systems,TRUE
18080,Ss_55_20_40,55,20,40,,Inert gas supply systems,TRUE
18090,Ss_55_20_45,55,20,45,,Laboratory gas supply systems,TRUE
18100,Ss_55_20_45_05,55,20,45,05,Laboratory argon supply systems,TRUE
18110,Ss_55_20_45_15,55,20,45,15,Laboratory compressed air supply systems,TRUE
18120,Ss_55_20_45_36,55,20,45,36,Laboratory helium supply systems,TRUE
18130,Ss_55_20_45_39,55,20,45,39,Laboratory hydrogen supply systems,TRUE
18140,Ss_55_20_45_56,55,20,45,56,Laboratory nitrogen supply systems,TRUE
18150,Ss_55_20_45_59,55,20,45,59,Laboratory oxygen supply systems,TRUE
18160,Ss_55_20_51,55,20,51,,Medical gas and vacuum systems,TRUE
18170,Ss_55_20_51_03,55,20,51,03,Medical anaesthetic gas scavenging systems,TRUE
18180,Ss_55_20_51_15,55,20,51,15,Medical compressed air supply systems,TRUE
18190,Ss_55_20_51_36,55,20,51,36,Medical helium/ oxygen mixture supply systems,TRUE
18200,Ss_55_20_51_56,55,20,51,56,Medical nitrous oxide supply systems,TRUE
18210,Ss_55_20_51_57,55,20,51,57,Medical nitrous oxide/ oxygen mixture supply systems,TRUE
18220,Ss_55_20_51_59,55,20,51,59,Medical oxygen supply systems,TRUE
18230,Ss_55_20_51_94,55,20,51,94,Medical vacuum systems,TRUE
18240,Ss_55_20_60,55,20,60,,Process gas systems,TRUE
18250,Ss_55_20_60_15,55,20,60,15,Compressed air supply systems,TRUE
18260,Ss_55_20_60_33,55,20,60,33,Gas vaporizing systems,TRUE
18270,Ss_55_20_85,55,20,85,,Specialist and high purity gas supply systems,TRUE
18280,Ss_55_30,55,30,,,Fire-extinguishing systems,TRUE
18290,Ss_55_30_30,55,30,30,,Foam fire-extinguishing and fire-suppression systems,TRUE
18300,Ss_55_30_30_31,55,30,30,31,Foam fire-extinguishing systems,TRUE
18310,Ss_55_30_35,55,30,35,,Gaseous fire-extinguishing systems,TRUE
18320,Ss_55_30_35_10,55,30,35,10,Carbon dioxide fire-extinguishing systems,TRUE
18330,Ss_55_30_35_35,55,30,35,35,Halocarbon gas total flooding fire-extinguishing systems,TRUE
18340,Ss_55_30_35_40,55,30,35,40,Inert gas total flooding fire-extinguishing systems,TRUE
18350,Ss_55_30_60,55,30,60,,Particle-based fire-extinguishing systems,TRUE
18360,Ss_55_30_60_15,55,30,60,15,Condensed aerosol fire-suppression systems,TRUE
18370,Ss_55_30_60_24,55,30,60,24,Dry chemical fire-extinguishing systems,TRUE
18380,Ss_55_30_65,55,30,65,,Portable fire-extinguishing systems,TRUE
18390,Ss_55_30_65_30,55,30,65,30,Fire blanket systems,TRUE
18400,Ss_55_30_65_35,55,30,65,35,Fire bucket systems,TRUE
18410,Ss_55_30_65_65,55,30,65,65,Portable fire extinguisher systems,TRUE
18420,Ss_55_30_96,55,30,96,,Water firefighting systems,TRUE
18430,Ss_55_30_96_24,55,30,96,24,Dry dropper systems,TRUE
18440,Ss_55_30_96_25,55,30,96,25,Dry riser systems,TRUE
18450,Ss_55_30_96_29,55,30,96,29,Fire hose reel systems,TRUE
18460,Ss_55_30_96_30,55,30,96,30,Fire hydrant systems,TRUE
18470,Ss_55_30_96_95,55,30,96,95,Water cannon firefighting systems,TRUE
18480,Ss_55_30_96_97,55,30,96,97,Wet riser systems,TRUE
18490,Ss_55_30_98,55,30,98,,Water fire suppression systems,TRUE
