ID,CODE,GROUP_CODE,SUB_GROUP_CODE,SECTION_CODE,OBJECT_CODE,TITLE,ACTIVE
10,Ss_15,15,,,,"Earthworks, remediation and temporary systems",TRUE
20,Ss_15_10,15,10,,,Groundworks and earthworks systems,TRUE
30,Ss_15_10_30,15,10,30,,"Excavating, filling and erosion control systems",TRUE
40,Ss_15_10_30_05,15,10,30,05,Backfill systems,TRUE
50,Ss_15_10_30_25,15,10,30,25,Earthworks excavating systems,TRUE
60,Ss_15_10_30_27,15,10,30,27,Earthworks filling systems,TRUE
70,Ss_15_10_30_29,15,10,30,29,Earthworks filling systems around trees,TRUE
80,Ss_15_10_30_31,15,10,30,31,Earthworks filling systems behind retaining walls,TRUE
90,Ss_15_10_30_33,15,10,30,33,Erosion control systems,TRUE
100,Ss_15_10_30_65,15,10,30,65,Puddled clay lining systems,TRUE
110,Ss_15_10_30_90,15,10,30,90,Topsoil filling systems,TRUE
120,Ss_15_10_33,15,10,33,,Ground gas disposal systems,TRUE
130,Ss_15_10_33_34,15,10,33,34,Ground gas collection and venting systems,TRUE
140,Ss_15_10_35,15,10,35,,Ground remediation systems,TRUE
150,Ss_15_10_35_07,15,10,35,07,Bioremediation systems,TRUE
160,Ss_15_10_35_23,15,10,35,23,Deep dry soil mixing systems,TRUE
170,Ss_15_10_35_25,15,10,35,25,Dynamic deep compaction systems,TRUE
180,Ss_15_10_35_92,15,10,35,92,Vibro-compaction systems,TRUE
190,Ss_15_10_35_94,15,10,35,94,Vibro-stone column systems,TRUE
200,Ss_15_10_35_97,15,10,35,97,Wet soil mixing systems,TRUE
210,Ss_15_10_45,15,10,45,,Landfill systems,TRUE
220,Ss_15_10_76,15,10,76,,Site waste disposal systems,TRUE
230,Ss_15_10_76_21,15,10,76,21,Dewatering systems,TRUE
240,Ss_15_10_78,15,10,78,,Slurry wall systems,TRUE
250,Ss_15_10_80,15,10,80,,Stabilization systems,TRUE
260,Ss_15_10_80_15,15,10,80,15,Concrete column stabilization systems,TRUE
270,Ss_15_10_80_70,15,10,80,70,Rock bolting and dowelling systems,TRUE
280,Ss_15_10_80_75,15,10,80,75,Rock fissure grouting systems,TRUE
290,Ss_15_10_80_80,15,10,80,80,Soil nailing systems,TRUE
300,Ss_15_10_80_85,15,10,80,85,Subterranean void filling systems,TRUE
310,Ss_15_30,15,30,,,"Remediation, repair and renovation systems",TRUE
320,Ss_15_30_10,15,30,10,,Building services remediation systems,TRUE
330,Ss_15_30_12,15,30,12,,Ceramics repair and renovation systems,TRUE
340,Ss_15_30_15,15,30,15,,Concrete and masonry cleaning systems,TRUE
350,Ss_15_30_15_15,15,30,15,15,Concrete cleaning systems,TRUE
360,Ss_15_30_15_50,15,30,15,50,Masonry cleaning systems,TRUE
370,Ss_15_30_15_65,15,30,15,65,Preliminary concrete cleaning systems,TRUE
380,Ss_15_30_15_66,15,30,15,66,Preliminary masonry cleaning systems,TRUE
390,Ss_15_30_17,15,30,17,,Concrete repair and renovation systems,TRUE
400,Ss_15_30_17_10,15,30,17,10,Bonded steel plate repair systems,TRUE
410,Ss_15_30_17_12,15,30,17,12,Concrete crack repair or filling systems,TRUE
420,Ss_15_30_17_14,15,30,17,14,Concrete mortar or overlay systems,TRUE
430,Ss_15_30_17_16,15,30,17,16,Concrete protective coating systems,TRUE
440,Ss_15_30_17_18,15,30,17,18,Concrete repair systems,TRUE
450,Ss_15_30_17_85,15,30,17,85,Sprayed concrete repair systems,TRUE
460,Ss_15_30_32,15,30,32,,Fungus and beetle eradication systems,TRUE
470,Ss_15_30_32_05,15,30,32,05,Beetle eradication systems,TRUE
480,Ss_15_30_32_15,15,30,32,15,Combined fungus and beetle treatment systems,TRUE
490,Ss_15_30_32_35,15,30,32,35,Hot air infestation treatment systems,TRUE
500,Ss_15_30_32_50,15,30,32,50,Masonry fungus treatment systems,TRUE
510,Ss_15_30_32_85,15,30,32,85,Termite treatment systems,TRUE
520,Ss_15_30_32_90,15,30,32,90,Timber fungus treatment systems,TRUE
530,Ss_15_30_33,15,30,33,,Glass repair and renovation systems,TRUE
540,Ss_15_30_50,15,30,50,,Masonry repair and renovation systems,TRUE
550,Ss_15_30_50_50,15,30,50,50,Masonry repair systems,TRUE
560,Ss_15_30_50_53,15,30,50,53,Mortar joint repair systems,TRUE
570,Ss_15_30_50_55,15,30,50,55,Mortar repointing systems,TRUE
580,Ss_15_30_52,15,30,52,,Metal repair and renovation systems,TRUE
590,Ss_15_30_52_03,15,30,52,03,Aluminium repair systems,TRUE
600,Ss_15_30_52_15,15,30,52,15,Copper repair systems,TRUE
610,Ss_15_30_52_42,15,30,52,42,Iron repair systems,TRUE
620,Ss_15_30_52_46,15,30,52,46,Lead repair systems,TRUE
630,Ss_15_30_52_84,15,30,52,84,Steel repair systems,TRUE
640,Ss_15_30_65,15,30,65,,Pipeline renovation systems,TRUE
650,Ss_15_30_65_15,15,30,65,15,Close-fit plastics pipe lining systems,TRUE
660,Ss_15_30_65_17,15,30,65,17,Continuous plastics pipe lining systems,TRUE
670,Ss_15_30_65_20,15,30,65,20,Cured in place lining systems,TRUE
680,Ss_15_30_65_65,15,30,65,65,Preformed lining systems,TRUE
690,Ss_15_30_65_72,15,30,65,72,Rigidly anchored plastics inner layer (RAPL) lining systems,TRUE
700,Ss_15_30_65_80,15,30,65,80,Spray lining systems,TRUE
710,Ss_15_30_65_81,15,30,65,81,Spirally wound plastics pipe lining systems,TRUE
720,Ss_15_30_90,15,30,90,,Timber repair and renovation systems,TRUE
730,Ss_15_30_90_84,15,30,90,84,Timber joint strengthening systems,TRUE
740,Ss_15_30_90_86,15,30,90,86,Timber section repair systems,TRUE
750,Ss_15_30_90_90,15,30,90,90,Timber section strengthening systems,TRUE
760,Ss_15_95,15,95,,,Temporary works systems,TRUE
770,Ss_15_95_15,15,95,15,,Temporary preparatory works systems,TRUE
780,Ss_15_95_15_10,15,95,15,10,Borehole systems,TRUE
790,Ss_15_95_17,15,95,17,,Temporary protection systems,TRUE
800,Ss_15_95_17_90,15,95,17,90,Temporary backfill systems,TRUE
810,Ss_15_95_20,15,95,20,,Temporary whole entity structural works systems,TRUE
820,Ss_15_95_20_30,15,95,20,30,Flying shores systems,TRUE
830,Ss_15_95_20_32,15,95,20,32,Framed retention structure systems,TRUE
840,Ss_15_95_20_70,15,95,20,70,Raking shores systems,TRUE
850,Ss_15_95_20_72,15,95,20,72,Retention structure systems,TRUE
860,Ss_15_95_20_75,15,95,20,75,Scaffold retention structure systems,TRUE
870,Ss_15_95_20_87,15,95,20,87,Thrust pit systems,TRUE
880,Ss_15_95_25,15,95,25,,Temporary wall and barrier works systems,TRUE
890,Ss_15_95_30,15,95,30,,"Temporary roof, floor and paving works systems",TRUE
900,Ss_15_95_32,15,95,32,,Temporary water and land management systems,TRUE
910,Ss_15_95_32_85,15,95,32,85,Sedimentation ponds,TRUE
920,Ss_15_95_35,15,95,35,,"Temporary fixed access, tunnel, shaft, vessel and tower works systems",TRUE
930,Ss_15_95_40,15,95,40,,"Temporary signage and fittings, furnishings and equipment (FF&E) works systems",TRUE
940,Ss_15_95_45,15,95,45,,Temporary flora and fauna systems,TRUE
950,Ss_15_95_45_42,15,95,45,42,Intercropping systems,TRUE
960,Ss_15_95_45_85,15,95,45,85,Spoil heap temporary crop systems,TRUE
970,Ss_15_95_45_90,15,95,45,90,Topsoil heap temporary crop systems,TRUE
980,Ss_15_95_55,15,95,55,,Temporary piped supply works systems,TRUE
990,Ss_15_95_55_90,15,95,55,90,Tunnelling compressed air systems,TRUE
1000,Ss_15_95_60,15,95,60,,"Temporary heating, cooling and refrigeration works systems",TRUE
1010,Ss_15_95_65,15,95,65,,Temporary ventilation and air conditioning works systems,TRUE
1020,Ss_15_95_70,15,95,70,,Temporary electrical works systems,TRUE
1030,Ss_15_95_75,15,95,75,,"Temporary communications, security, safety, control and protection works systems",TRUE
1040,Ss_15_95_80,15,95,80,,Temporary pavement works systems,TRUE
1050,Ss_15_95_80_02,15,95,80,02,Temporary access road systems,TRUE
1060,Ss_15_95_80_72,15,95,80,72,Temporary roadwork systems,TRUE
1070,Ss_15_95_85,15,95,85,,Temporary process engineering works systems,TRUE
1080,Ss_15_95_90,15,95,90,,Temporary soft facility management works services,TRUE
1090,Ss_20,20,,,,Structural systems,TRUE
1100,Ss_20_05,20,05,,,Substructure systems,TRUE
1110,Ss_20_05_15,20,05,15,,Concrete foundation systems,TRUE
1120,Ss_20_05_15_65,20,05,15,65,Precast concrete pad and strip foundation systems,TRUE
1130,Ss_20_05_15_70,20,05,15,70,Reinforced concrete pad and strip foundation systems,TRUE
1140,Ss_20_05_15_71,20,05,15,71,Reinforced concrete pilecap and ground beam foundation systems,TRUE
1150,Ss_20_05_15_72,20,05,15,72,Reinforced concrete raft foundation systems,TRUE
1160,Ss_20_05_15_80,20,05,15,80,Steel ground beam foundation systems,TRUE
1170,Ss_20_05_15_90,20,05,15,90,Unreinforced concrete foundation systems for cast-in products,TRUE
1180,Ss_20_05_15_91,20,05,15,91,Unreinforced concrete pad and strip foundation systems,TRUE
1190,Ss_20_05_15_92,20,05,15,92,Unreinforced concrete trench fill foundation systems,TRUE
1200,Ss_20_05_50,20,05,50,,Minor concrete substructure systems,TRUE
1210,Ss_20_05_50_15,20,05,50,15,Concrete haunching systems,TRUE
1220,Ss_20_05_50_65,20,05,50,65,Precast concrete foundation and plinth systems,TRUE
1230,Ss_20_05_50_70,20,05,50,70,Reinforced concrete base or foundation systems,TRUE
1240,Ss_20_05_50_92,20,05,50,92,Unreinforced concrete foundation with cast-in products systems,TRUE
1250,Ss_20_05_50_93,20,05,50,93,Unreinforced concrete foundation and plinth systems,TRUE
1260,Ss_20_05_65,20,05,65,,Piling systems,TRUE
1270,Ss_20_05_65_24,20,05,65,24,Driven precast or prestressed concrete piling systems,TRUE
1280,Ss_20_05_65_40,20,05,65,40,In situ concrete augered piling systems,TRUE
1290,Ss_20_05_65_41,20,05,65,41,In situ concrete bored piling systems,TRUE
1300,Ss_20_05_65_42,20,05,65,42,In situ concrete cased displacement piling systems,TRUE
1310,Ss_20_05_65_43,20,05,65,43,In situ concrete displacement piling systems,TRUE
1320,Ss_20_05_65_44,20,05,65,44,In situ concrete mini-piling or micro-piling systems,TRUE
1330,Ss_20_05_65_64,20,05,65,64,Plunge column piling systems,TRUE
1340,Ss_20_05_65_76,20,05,65,76,Screw piling systems,TRUE
1350,Ss_20_05_65_84,20,05,65,84,Steel bearing pile systems,TRUE
1360,Ss_20_05_65_89,20,05,65,89,Timber piling systems,TRUE
1370,Ss_20_05_80,20,05,80,,Structural grouting systems,TRUE
1380,Ss_20_05_80_12,20,05,80,12,Cementitious grout systems,TRUE
1390,Ss_20_05_80_40,20,05,80,40,Interstitial grouting systems,TRUE
1400,Ss_20_05_80_57,20,05,80,57,Non-cementitious grout systems,TRUE
1410,Ss_20_05_80_71,20,05,80,71,Retaining wall cementitious grout systems,TRUE
1420,Ss_20_05_80_73,20,05,80,73,Retaining wall self-hardening slurry systems,TRUE
1430,Ss_20_05_80_80,20,05,80,80,Soil nailing cementitious grout systems,TRUE
1440,Ss_20_05_90,20,05,90,,Underpinning systems,TRUE
1450,Ss_20_05_90_10,20,05,90,10,Beam and pier unreinforced concrete underpinning systems,TRUE
1460,Ss_20_05_90_35,20,05,90,35,Grouted underpinning systems,TRUE
1470,Ss_20_05_90_45,20,05,90,45,Jacked pile underpinning systems,TRUE
1480,Ss_20_05_90_46,20,05,90,46,Jet grouted underpinning systems,TRUE
1490,Ss_20_05_90_50,20,05,90,50,Mass concrete underpinning systems,TRUE
1500,Ss_20_05_90_60,20,05,90,60,Pile and cantilever support underpinning systems,TRUE
1510,Ss_20_05_90_61,20,05,90,61,Pile and needle underpinning systems,TRUE
1520,Ss_20_05_90_70,20,05,90,70,Raking pile underpinning systems,TRUE
1530,Ss_20_10,20,10,,,Structural frame systems,TRUE
1540,Ss_20_10_30,20,10,30,,Complete bridge structure systems,TRUE
1550,Ss_20_10_30_30,20,10,30,30,Footbridge systems,TRUE
1560,Ss_20_10_30_65,20,10,30,65,Pipe bridge systems,TRUE
1570,Ss_20_10_60,20,10,60,,Prefabricated framed and panelled structures,TRUE
1580,Ss_20_10_60_33,20,10,60,33,Geodesic dome systems,TRUE
1590,Ss_20_10_60_34,20,10,60,34,Glazed enclosure systems,TRUE
1600,Ss_20_10_60_50,20,10,60,50,Modular pod systems,TRUE
1610,Ss_20_10_60_60,20,10,60,60,Panelled and framed modular systems,TRUE
1620,Ss_20_10_60_84,20,10,60,84,Structural insulated panel systems,TRUE
1630,Ss_20_10_60_95,20,10,60,95,Volumetric modular systems,TRUE
1640,Ss_20_10_65,20,10,65,,Prefabricated room systems,TRUE
1650,Ss_20_10_65_15,20,10,65,15,Composite pods,TRUE
1660,Ss_20_10_65_17,20,10,65,17,Concrete pods,TRUE
1670,Ss_20_10_65_65,20,10,65,65,Polypropylene pods,TRUE
1680,Ss_20_10_70,20,10,70,,Shelter systems,TRUE
1690,Ss_20_10_70_03,20,10,70,03,Animal shelter systems,TRUE
1700,Ss_20_10_70_62,20,10,70,62,People shelter systems,TRUE
1710,Ss_20_10_70_64,20,10,70,64,Plant shelter systems,TRUE
1720,Ss_20_10_70_84,20,10,70,84,Storage shelter systems,TRUE
1730,Ss_20_10_75,20,10,75,,Structural framing systems,TRUE
1740,Ss_20_10_75_35,20,10,75,35,Heavy steel framing systems,TRUE
1750,Ss_20_10_75_45,20,10,75,45,Light steel framing systems,TRUE
1760,Ss_20_10_75_65,20,10,75,65,Precast reinforced concrete framing systems,TRUE
1770,Ss_20_10_75_70,20,10,75,70,Reinforced concrete framing systems,TRUE
1780,Ss_20_10_75_85,20,10,75,85,Timber framing systems,TRUE
1790,Ss_20_20,20,20,,,Structural beams,TRUE
1800,Ss_20_20_75,20,20,75,,Structural beam systems,TRUE
1810,Ss_20_20_75_35,20,20,75,35,Heavy steel beam systems,TRUE
1820,Ss_20_20_75_45,20,20,75,45,Light steel beam systems,TRUE
1830,Ss_20_20_75_65,20,20,75,65,Precast reinforced concrete beam systems,TRUE
1840,Ss_20_20_75_70,20,20,75,70,Reinforced concrete beam systems,TRUE
1850,Ss_20_20_75_85,20,20,75,85,Timber beam systems,TRUE
1860,Ss_20_30,20,30,,,Structural columns,TRUE
1870,Ss_20_30_75,20,30,75,,Structural column systems,TRUE
1880,Ss_20_30_75_35,20,30,75,35,Heavy steel column systems,TRUE
1890,Ss_20_30_75_45,20,30,75,45,Light steel column systems,TRUE
1900,Ss_20_30_75_50,20,30,75,50,Masonry column systems,TRUE
1910,Ss_20_30_75_65,20,30,75,65,Precast reinforced concrete column systems,TRUE
1920,Ss_20_30_75_70,20,30,75,70,Reinforced concrete column systems,TRUE
1930,Ss_20_30_75_85,20,30,75,85,Timber column systems,TRUE
1940,Ss_20_40,20,40,,,Structural sheet and cable systems,TRUE
1950,Ss_20_40_10,20,40,10,,Building cable systems,TRUE
1960,Ss_20_50,20,50,,,Bridge structure systems,TRUE
1970,Ss_20_50_10,20,50,10,,Abutment systems,TRUE
1980,Ss_20_50_10_10,20,50,10,10,Bank seat abutments,TRUE
1990,Ss_20_50_10_30,20,50,10,30,Embedded retaining wall bridge abutments,TRUE
2000,Ss_20_50_10_40,20,50,10,40,Integral abutments,TRUE
2010,Ss_20_50_10_50,20,50,10,50,Masonry bridge abutments,TRUE
2020,Ss_20_50_10_70,20,50,10,70,Reinforced concrete bridge abutments,TRUE
2030,Ss_20_50_10_80,20,50,10,80,Sheet piled bridge abutments,TRUE
2040,Ss_20_50_10_85,20,50,10,85,Spill-through abutments,TRUE
2050,Ss_20_50_10_90,20,50,10,90,Tied embedded retaining wall bridge abutments,TRUE
2060,Ss_20_50_10_95,20,50,10,95,Wing wall systems,TRUE
2070,Ss_20_50_20,20,50,20,,Bridge pier systems,TRUE
2080,Ss_20_50_20_50,20,50,20,50,Masonry bridge piers,TRUE
2090,Ss_20_50_20_70,20,50,20,70,Reinforced concrete bridge piers,TRUE
2100,Ss_20_50_25,20,50,25,,Bridge deck systems,TRUE
2110,Ss_20_50_25_08,20,50,25,08,Box girder bridge deck systems,TRUE
2120,Ss_20_50_25_12,20,50,25,12,Composite steel and concrete bridge deck systems,TRUE
2130,Ss_20_50_25_15,20,50,25,15,Concrete half through deck systems,TRUE
2140,Ss_20_50_25_16,20,50,25,16,Concrete slab deck systems,TRUE
2150,Ss_20_50_25_30,20,50,25,30,Filler beam deck systems,TRUE
2160,Ss_20_50_25_31,20,50,25,31,Flat and stepped deck systems,TRUE
2170,Ss_20_50_25_53,20,50,25,53,Modular precast concrete deck systems,TRUE
2180,Ss_20_50_25_59,20,50,25,59,Orthotropic deck systems,TRUE
2190,Ss_20_50_25_65,20,50,25,65,Prestressed concrete beam deck systems,TRUE
2200,Ss_20_50_25_70,20,50,25,70,Reinforced concrete arch bridge systems,TRUE
2210,Ss_20_50_25_80,20,50,25,80,Solid steel slab systems,TRUE
2220,Ss_20_50_30,20,50,30,,Abutment and pier component systems,TRUE
2230,Ss_20_50_30_11,20,50,30,11,Capping beam systems,TRUE
2240,Ss_20_50_30_37,20,50,30,37,Headwall systems,TRUE
2250,Ss_20_50_30_80,20,50,30,80,Spandrel arch wall systems,TRUE
2260,Ss_20_50_35,20,50,35,,Bridge cable systems,TRUE
2270,Ss_20_50_35_11,20,50,35,11,Cable-stayed bridge cable systems,TRUE
2280,Ss_20_50_35_85,20,50,35,85,Suspension bridge cable systems,TRUE
2290,Ss_20_50_40,20,50,40,,Bridge expansion joint systems,TRUE
2300,Ss_20_50_40_04,20,50,40,04,Asphaltic plug joint systems,TRUE
2310,Ss_20_50_40_09,20,50,40,09,Buried expansion joint systems,TRUE
2320,Ss_20_50_40_56,20,50,40,56,Nosing expansion joint systems with poured sealants,TRUE
2330,Ss_20_50_40_57,20,50,40,57,Nosing expansion joint systems with preformed compression seals,TRUE
2340,Ss_20_60,20,60,,,Retaining wall systems,TRUE
2350,Ss_20_60_30,20,60,30,,Embedded retaining wall systems,TRUE
2360,Ss_20_60_30_03,20,60,30,03,Anchored steel sheet pile retaining wall systems,TRUE
2370,Ss_20_60_30_08,20,60,30,08,Bored king post retaining wall systems,TRUE
2380,Ss_20_60_30_13,20,60,30,13,Combi retaining wall systems,TRUE
2390,Ss_20_60_30_15,20,60,30,15,Contiguous pile retaining wall systems,TRUE
2400,Ss_20_60_30_24,20,60,30,24,Driven king post retaining wall systems,TRUE
2410,Ss_20_60_30_70,20,60,30,70,Reinforced concrete diaphragm retaining wall systems,TRUE
2420,Ss_20_60_30_80,20,60,30,80,Secant pile retaining wall systems,TRUE
2430,Ss_20_60_30_83,20,60,30,83,Slurry diaphragm retaining wall systems,TRUE
2440,Ss_20_60_30_85,20,60,30,85,Steel sheet pile retaining wall systems,TRUE
2450,Ss_20_60_30_92,20,60,30,92,Unreinforced concrete diaphragm retaining wall systems,TRUE
2460,Ss_20_60_35,20,60,35,,Gravity retaining wall systems,TRUE
2470,Ss_20_60_35_10,20,60,35,10,Caged fill retaining wall systems,TRUE
2480,Ss_20_60_35_13,20,60,35,13,Concrete bagwork retaining wall systems,TRUE
2490,Ss_20_60_35_15,20,60,35,15,Crib retaining wall systems,TRUE
2500,Ss_20_60_35_25,20,60,35,25,Drystack masonry unit retaining wall systems,TRUE
2510,Ss_20_60_35_50,20,60,35,50,Masonry retaining wall systems,TRUE
2520,Ss_20_60_35_53,20,60,35,53,Mesh formwork and geogrid retaining wall systems,TRUE
2530,Ss_20_60_35_66,20,60,35,66,Precast concrete stem wall retaining wall systems,TRUE
2540,Ss_20_60_35_70,20,60,35,70,Reinforced concrete retaining wall systems,TRUE
2550,Ss_20_60_35_72,20,60,35,72,Reinforced earth retaining wall systems,TRUE
2560,Ss_20_60_35_90,20,60,35,90,Timber retaining wall systems,TRUE
2570,Ss_20_60_35_91,20,60,35,91,Tyre bale retaining wall systems,TRUE
2580,Ss_20_70,20,70,,,Structure covering and finishing systems,TRUE
2590,Ss_20_70_15,20,70,15,,Concrete protection systems,TRUE
2600,Ss_20_70_65,20,70,65,,Protective painting systems,TRUE
2610,Ss_20_70_80,20,70,80,,Steel encasement systems,TRUE
2620,Ss_20_80,20,80,,,Structure accessory systems,TRUE
2630,Ss_20_80_60,20,80,60,,Permanent formwork systems,TRUE
2640,Ss_20_95,20,95,,,Temporary structural systems,TRUE
2650,Ss_25,25,,,,Wall and barrier systems,TRUE
2660,Ss_25_10,25,10,,,Framed wall systems,TRUE
2670,Ss_25_10_20,25,10,20,,Curtain walling systems,TRUE
2680,Ss_25_10_20_85,25,10,20,85,Stick curtain walling systems,TRUE
2690,Ss_25_10_20_90,25,10,20,90,Unitized curtain walling systems,TRUE
2700,Ss_25_10_30,25,10,30,,Framed partition systems,TRUE
2710,Ss_25_10_30_35,25,10,30,35,Gypsum board partition systems,TRUE
2720,Ss_25_10_30_70,25,10,30,70,Rigid sheet partition systems,TRUE
2730,Ss_25_10_32,25,10,32,,Framed wall structure systems,TRUE
2740,Ss_25_10_32_03,25,10,32,03,Aluminium wall framing systems,TRUE
2750,Ss_25_10_32_35,25,10,32,35,Heavy steel wall framing systems,TRUE
2760,Ss_25_10_32_45,25,10,32,45,Light steel wall framing systems,TRUE
2770,Ss_25_10_32_58,25,10,32,58,Plastics wall framing systems,TRUE
2780,Ss_25_10_32_90,25,10,32,90,Timber wall framing systems,TRUE
2790,Ss_25_10_35,25,10,35,,Framed glazed wall systems,TRUE
2800,Ss_25_10_35_35,25,10,35,35,Glazed screen systems,TRUE
2810,Ss_25_10_35_95,25,10,35,95,Vertical patent glazing systems,TRUE
2820,Ss_25_10_35_97,25,10,35,97,Window wall glazed screen systems,TRUE
2830,Ss_25_11,25,11,,,Monolithic wall structure systems,TRUE
2840,Ss_25_11_13,25,11,13,,Cob wall systems,TRUE
2850,Ss_25_11_15,25,11,15,,Concrete form masonry unit wall systems,TRUE
2860,Ss_25_11_16,25,11,16,,Concrete wall systems,TRUE
2870,Ss_25_11_16_62,25,11,16,62,Post-tensioned concrete wall systems,TRUE
2880,Ss_25_11_16_65,25,11,16,65,Precast concrete wall systems,TRUE
2890,Ss_25_11_16_70,25,11,16,70,Reinforced concrete wall structure systems,TRUE
2900,Ss_25_11_16_80,25,11,16,80,Sprayed concrete wall structure systems,TRUE
2910,Ss_25_11_70,25,11,70,,Rammed earth wall systems,TRUE
2920,Ss_25_11_70_55,25,11,70,55,Non-stabilized rammed earth wall systems,TRUE
2930,Ss_25_11_70_83,25,11,70,83,Stabilized rammed earth plinth systems,TRUE
2940,Ss_25_11_70_85,25,11,70,85,Stabilized rammed earth wall systems,TRUE
2950,Ss_25_11_90,25,11,90,,Timber wall systems,TRUE
2960,Ss_25_11_90_15,25,11,90,15,Cross-laminated timber wall systems,TRUE
2970,Ss_25_11_90_96,25,11,90,96,Wood log wall systems,TRUE
2980,Ss_25_12,25,12,,,Panel wall structure systems,TRUE
2990,Ss_25_12_10,25,12,10,,Brick panel wall systems,TRUE
3000,Ss_25_12_15,25,12,15,,Concrete panel wall systems,TRUE
3010,Ss_25_12_15_05,25,12,15,05,Autoclaved aerated concrete (AAC) panel wall systems,TRUE
3020,Ss_25_12_15_15,25,12,15,15,Composite concrete panel wall systems,TRUE
3030,Ss_25_12_60,25,12,60,,Panel enclosure systems,TRUE
3040,Ss_25_12_60_30,25,12,60,30,Fully-framed panel cubicle systems,TRUE
3050,Ss_25_12_60_60,25,12,60,60,Panel cubicle systems,TRUE
3060,Ss_25_12_60_65,25,12,60,65,Privacy screen systems,TRUE
3070,Ss_25_12_65,25,12,65,,Partitioning systems,TRUE
3080,Ss_25_12_65_50,25,12,65,50,Media wall systems,TRUE
3090,Ss_25_12_65_55,25,12,65,55,Mesh panel partition systems,TRUE
3100,Ss_25_12_65_60,25,12,65,60,Plasterboard laminated partition systems,TRUE
3110,Ss_25_12_65_65,25,12,65,65,Panel partition systems,TRUE
3120,Ss_25_12_65_70,25,12,65,70,Relocatable partition and ceiling systems,TRUE
3130,Ss_25_12_65_75,25,12,65,75,Relocatable partition systems,TRUE
3140,Ss_25_12_65_85,25,12,65,85,Storage wall systems,TRUE
3150,Ss_25_12_70,25,12,70,,Retractable partition systems,TRUE
3160,Ss_25_12_70_30,25,12,70,30,Fabric dividing partition systems,TRUE
3170,Ss_25_12_70_80,25,12,70,80,Sliding stacking panel partition systems,TRUE
3180,Ss_25_12_80,25,12,80,,Structural glass wall systems,TRUE
3190,Ss_25_12_80_65,25,12,80,65,Point-fixed structural glass wall systems,TRUE
3200,Ss_25_12_80_83,25,12,80,83,Stacked structural glass wall systems,TRUE
3210,Ss_25_12_80_85,25,12,80,85,Suspended structural glass wall systems,TRUE
3220,Ss_25_12_85,25,12,85,,Structural steel panel wall systems,TRUE
3230,Ss_25_12_85_60,25,12,85,60,Prefabricated metal wall systems,TRUE
3240,Ss_25_12_85_63,25,12,85,63,Profile metal sheet wall systems,TRUE
3250,Ss_25_13,25,13,,,Unit wall structure systems,TRUE
3260,Ss_25_13_05,25,13,05,,Adobe block wall systems,TRUE
3270,Ss_25_13_24,25,13,24,,Dry stone wall systems,TRUE
3280,Ss_25_13_33,25,13,33,,Glass wall systems,TRUE
3290,Ss_25_13_33_33,25,13,33,33,Glass block wall systems,TRUE
3300,Ss_25_13_33_64,25,13,33,64,Prefabricated glass block wall systems,TRUE
3310,Ss_25_13_35,25,13,35,,Gypsum block wall systems,TRUE
3320,Ss_25_13_45,25,13,45,,Lead brick wall systems,TRUE
3330,Ss_25_13_50,25,13,50,,Masonry wall systems,TRUE
3340,Ss_25_13_50_49,25,13,50,49,Masonry exposed feature systems,TRUE
3350,Ss_25_13_50_51,25,13,50,51,Masonry wall leaf systems,TRUE
3360,Ss_25_13_50_54,25,13,50,54,Masonry free-standing wall leaf systems,TRUE
3370,Ss_25_13_50_56,25,13,50,56,Masonry internal partition systems,TRUE
3380,Ss_25_13_70,25,13,70,,Reinforced masonry wall systems,TRUE
3390,Ss_25_13_70_71,25,13,70,71,Reinforced masonry wall leaf systems,TRUE
3400,Ss_25_13_70_74,25,13,70,74,Reinforced masonry free-standing wall leaf systems,TRUE
3410,Ss_25_13_70_76,25,13,70,76,Reinforced masonry internal partition systems,TRUE
3420,Ss_25_13_85,25,13,85,,Straw bale wall systems,TRUE
3430,Ss_25_13_85_30,25,13,85,30,Framed straw bale wall systems,TRUE
3440,Ss_25_13_85_95,25,13,85,95,Unframed straw bale wall systems,TRUE
3450,Ss_25_14,25,14,,,Fence systems,TRUE
3460,Ss_25_14_30,25,14,30,,Framed fence systems,TRUE
3470,Ss_25_14_30_56,25,14,30,56,Natural stone fencing systems,TRUE
3480,Ss_25_14_55,25,14,55,,Monolithic fence systems,TRUE
3490,Ss_25_14_63,25,14,63,,"Post, rail and board fence systems",TRUE
3500,Ss_25_14_63_06,25,14,63,06,Bespoke fencing systems,TRUE
3510,Ss_25_14_63_08,25,14,63,08,Board or palisade fencing systems,TRUE
3520,Ss_25_14_63_11,25,14,63,11,Carbon steel continuous bar fencing systems,TRUE
3530,Ss_25_14_63_51,25,14,63,51,Metal post and rail fencing systems,TRUE
3540,Ss_25_14_63_52,25,14,63,52,Metal vertical pale fencing systems,TRUE
3550,Ss_25_14_63_56,25,14,63,56,Natural hurdle fencing systems,TRUE
3560,Ss_25_14_63_62,25,14,63,62,Post and panel fencing systems,TRUE
3570,Ss_25_14_63_63,25,14,63,63,Post and rail fencing systems,TRUE
3580,Ss_25_14_63_64,25,14,63,64,Precast concrete palisade fencing systems,TRUE
3590,Ss_25_14_63_65,25,14,63,65,Precast concrete post and panel fencing systems,TRUE
3600,Ss_25_14_63_66,25,14,63,66,Precast concrete post and rail fencing systems,TRUE
3610,Ss_25_14_63_67,25,14,63,67,Prefabricated wood or plastics panel fencing systems,TRUE
3620,Ss_25_14_63_84,25,14,63,84,Steel hurdle fencing systems,TRUE
3630,Ss_25_14_63_85,25,14,63,85,Steel palisade panel fencing systems,TRUE
3640,Ss_25_14_63_86,25,14,63,86,Steel vertical bar fencing systems,TRUE
3650,Ss_25_14_63_95,25,14,63,95,Wood close boarded fencing systems,TRUE
3660,Ss_25_14_63_96,25,14,63,96,Wood palisade fencing systems,TRUE
3670,Ss_25_14_63_97,25,14,63,97,Wood post and rail fencing systems,TRUE
3680,Ss_25_14_63_98,25,14,63,98,Wrought iron panel fencing systems,TRUE
3690,Ss_25_14_67,25,14,67,,"Post, wire and mesh fence systems",TRUE
3700,Ss_25_14_67_12,25,14,67,12,Chain link fencing systems,TRUE
3710,Ss_25_14_67_14,25,14,67,14,Cleft chestnut pale fencing systems,TRUE
3720,Ss_25_14_67_15,25,14,67,15,Continuous mesh fencing systems,TRUE
3730,Ss_25_14_67_24,25,14,67,24,Dropper pattern strained wire fencing systems,TRUE
3740,Ss_25_14_67_27,25,14,67,27,Electric fencing systems,TRUE
3750,Ss_25_14_67_28,25,14,67,28,Electric security fencing systems,TRUE
3760,Ss_25_14_67_33,25,14,67,33,General pattern strained wire fencing systems,TRUE
