ID,CODE,GROUP_CODE,SUB_GROUP_CODE,SECTION_CODE,OBJECT_CODE,TITLE,ACTIVE
7550,Ss_30_14_90_12,30,14,90,12,Cellular plastics gravel-filled paving systems,TRUE
7560,Ss_30_14_90_30,30,14,90,30,Flag and slab bound paving systems,TRUE
7570,Ss_30_14_90_32,30,14,90,32,Flag and slab paving overlay systems,TRUE
7580,Ss_30_14_90_34,30,14,90,34,Flag and slab pedestal-supported paving systems,TRUE
7590,Ss_30_14_90_36,30,14,90,36,Flag and slab unbound paving systems,TRUE
7600,Ss_30_14_90_50,30,14,90,50,Mosaic paving systems,TRUE
7610,Ss_30_14_90_60,30,14,90,60,Permeable flag and slab paving systems,TRUE
7620,Ss_30_14_90_62,30,14,90,62,Permeable small unit paving systems,TRUE
7630,Ss_30_14_90_70,30,14,90,70,Rail track paving systems,TRUE
7640,Ss_30_14_90_75,30,14,90,75,Small unit bound paving systems,TRUE
7650,Ss_30_14_90_80,30,14,90,80,Small unit paving overlay systems,TRUE
7660,Ss_30_14_90_85,30,14,90,85,Small unit unbound paving systems,TRUE
7670,Ss_30_20,30,20,,,Flooring and decking systems,TRUE
7680,Ss_30_20_10,30,20,10,,Board and rigid sheet floor systems,TRUE
7690,Ss_30_20_10_10,30,20,10,10,Battened timber board floating floor systems,TRUE
7700,Ss_30_20_10_15,30,20,10,15,Battened wood-based rigid sheet floating floor systems,TRUE
7710,Ss_30_20_10_43,30,20,10,43,Joist-supported mineral-based sheet and board floor systems,TRUE
7720,Ss_30_20_10_45,30,20,10,45,Joist-supported timber board floor systems,TRUE
7730,Ss_30_20_10_50,30,20,10,50,Joist-supported wood-based rigid sheet floor systems,TRUE
7740,Ss_30_20_10_95,30,20,10,95,Wood-based rigid sheet floating floor systems,TRUE
7750,Ss_30_20_22,30,20,22,,Demountable athletics floor systems,TRUE
7760,Ss_30_20_30,30,20,30,,External deck and boardwalk systems,TRUE
7770,Ss_30_20_30_10,30,20,30,10,Boardwalk systems,TRUE
7780,Ss_30_20_30_25,30,20,30,25,Decking systems,TRUE
7790,Ss_30_20_70,30,20,70,,Raised floor systems,TRUE
7800,Ss_30_20_70_70,30,20,70,70,Raised access floor systems,TRUE
7810,Ss_30_20_90,30,20,90,,Wood and composite unit flooring systems,TRUE
7820,Ss_30_20_90_15,30,20,90,15,Composition block flooring systems,TRUE
7830,Ss_30_20_90_50,30,20,90,50,Mosaic parquet panel flooring systems,TRUE
7840,Ss_30_20_90_95,30,20,90,95,Wood block flooring systems,TRUE
7850,Ss_30_20_95,30,20,95,,Wood strip and board fine flooring systems,TRUE
7860,Ss_30_20_95_10,30,20,95,10,Battened wood floating floor systems,TRUE
7870,Ss_30_20_95_15,30,20,95,15,Composite laminate floating floor systems,TRUE
7880,Ss_30_20_95_20,30,20,95,20,Direct-fixed wood floor systems,TRUE
7890,Ss_30_20_95_25,30,20,95,25,Direct-glued wood floor systems,TRUE
7900,Ss_30_20_95_95,30,20,95,95,Wood floating floor systems,TRUE
7910,Ss_30_25,30,25,,,Ceiling and soffit systems,TRUE
7920,Ss_30_25_10,30,25,10,,Board and sheet ceiling systems,TRUE
7930,Ss_30_25_10_10,30,25,10,10,Board suspended ceiling systems,TRUE
7940,Ss_30_25_10_26,30,25,10,26,External ceiling systems,TRUE
7950,Ss_30_25_10_28,30,25,10,28,External soffit systems,TRUE
7960,Ss_30_25_10_35,30,25,10,35,Gypsum board suspended ceiling systems,TRUE
7970,Ss_30_25_10_52,30,25,10,52,Monolithic suspended ceiling systems,TRUE
7980,Ss_30_25_10_80,30,25,10,80,Soffit lining and beam casing systems,TRUE
7990,Ss_30_25_22,30,25,22,,Demountable suspended ceiling systems,TRUE
8000,Ss_30_25_22_01,30,25,22,01,Acoustic baffle suspended ceiling systems,TRUE
8010,Ss_30_25_22_30,30,25,22,30,Fabric membrane ceiling systems,TRUE
8020,Ss_30_25_22_47,30,25,22,47,Linear ceiling lining systems,TRUE
8030,Ss_30_25_22_51,30,25,22,51,Modular suspended ceiling systems,TRUE
8040,Ss_30_25_22_70,30,25,22,70,Raft or island suspended ceiling systems,TRUE
8050,Ss_30_30,30,30,,,Roof and floor opening systems,TRUE
8060,Ss_30_30_15,30,30,15,,Concrete roof and floor glazing systems,TRUE
8070,Ss_30_30_15_42,30,30,15,42,In situ concrete roof and floor glazing systems,TRUE
8080,Ss_30_30_15_64,30,30,15,64,Precast concrete lift-out access roof and floor glazing systems,TRUE
8090,Ss_30_30_15_65,30,30,15,65,Precast concrete roof and floor glazing systems,TRUE
8100,Ss_30_30_30,30,30,30,,Floor hatch systems,TRUE
8110,Ss_30_30_34,30,30,34,,Glass unit masonry roof light systems,TRUE
8120,Ss_30_30_71,30,30,71,,Roof hatch systems,TRUE
8130,Ss_30_30_72,30,30,72,,Rooflight and roof window systems,TRUE
8140,Ss_30_30_72_21,30,30,72,21,Daylight pipe systems,TRUE
8150,Ss_30_30_72_72,30,30,72,72,Rooflight systems,TRUE
8160,Ss_30_30_72_73,30,30,72,73,Roof window systems,TRUE
8170,Ss_30_30_73,30,30,73,,Roof ventilator systems,TRUE
8180,Ss_30_30_73_60,30,30,73,60,Passive roof natural ventilator systems,TRUE
8190,Ss_30_30_73_72,30,30,73,72,Roof smoke ventilator systems,TRUE
8200,Ss_30_34,30,34,,,Pavement opening systems,TRUE
8210,Ss_30_34_03,30,34,03,,Animal grid systems,TRUE
8220,Ss_30_34_03_11,30,34,03,11,Cattle grid systems,TRUE
8230,Ss_30_34_15,30,34,15,,Pavement glazing systems,TRUE
8240,Ss_30_34_15_15,30,34,15,15,Concrete pavement glazing systems,TRUE
8250,Ss_30_34_15_64,30,34,15,64,Precast concrete lift-out access pavement glazing systems,TRUE
8260,Ss_30_34_15_65,30,34,15,65,Precast concrete pavement glazing systems,TRUE
8270,Ss_30_34_16,30,34,16,,Pavement smoke venting systems,TRUE
8280,Ss_30_34_16_15,30,34,16,15,Concrete pavement glazing smoke venting systems,TRUE
8290,Ss_30_34_16_16,30,34,16,16,Concrete pavement non-glazed smoke venting systems,TRUE
8300,Ss_30_34_16_64,30,34,16,64,Precast concrete pavement glazing smoke venting systems,TRUE
8310,Ss_30_34_16_65,30,34,16,65,Precast concrete pavement non-glazed smoke venting systems,TRUE
8320,Ss_30_36,30,36,,,Ceiling and soffit opening systems,TRUE
8330,Ss_30_36_10,30,36,10,,Ceiling hatch systems,TRUE
8340,Ss_30_36_75,30,36,75,,Soffit vent systems,TRUE
8350,Ss_30_40,30,40,,,Roof and balcony covering and finish systems,TRUE
8360,Ss_30_40_10,30,40,10,,Board roof covering systems,TRUE
8370,Ss_30_40_10_30,30,40,10,30,Flat board roof deck systems,TRUE
8380,Ss_30_40_10_60,30,40,10,60,Pitched board roof sarking systems,TRUE
8390,Ss_30_40_30,30,40,30,,Flat roof covering systems,TRUE
8400,Ss_30_40_30_07,30,40,30,07,Blue roof systems,TRUE
8410,Ss_30_40_30_40,30,40,30,40,Liquid-applied cold roof covering systems,TRUE
8420,Ss_30_40_30_42,30,40,30,42,Liquid-applied inverted roof covering systems,TRUE
8430,Ss_30_40_30_43,30,40,30,43,Liquid-applied warm roof covering systems,TRUE
8440,Ss_30_40_30_50,30,40,30,50,Mastic asphalt cold roof covering systems,TRUE
8450,Ss_30_40_30_52,30,40,30,52,Mastic asphalt inverted roof covering systems,TRUE
8460,Ss_30_40_30_55,30,40,30,55,Mastic asphalt warm roof covering systems,TRUE
8470,Ss_30_40_30_70,30,40,30,70,Reinforced bitumen membrane cold roof covering systems,TRUE
8480,Ss_30_40_30_71,30,40,30,71,Reinforced bitumen membrane inverted roof covering systems,TRUE
8490,Ss_30_40_30_72,30,40,30,72,Reinforced bitumen membrane warm roof covering systems,TRUE
8500,Ss_30_40_30_78,30,40,30,78,Single layer sheet cold roof covering systems,TRUE
8510,Ss_30_40_30_79,30,40,30,79,Single layer sheet inverted roof covering systems,TRUE
8520,Ss_30_40_30_80,30,40,30,80,Single layer sheet warm roof covering systems,TRUE
8530,Ss_30_40_32,30,40,32,,Framed glazed roof systems,TRUE
8540,Ss_30_40_32_75,30,40,32,75,Sloping patent glazing systems,TRUE
8550,Ss_30_40_34,30,40,34,,Glass roofing systems,TRUE
8560,Ss_30_40_34_15,30,40,34,15,Cantilevered structural glass beam canopy systems,TRUE
8570,Ss_30_40_34_60,30,40,34,60,Point-fixed structural glass canopy systems,TRUE
8580,Ss_30_40_34_65,30,40,34,65,Point-fixed structural glass roof systems,TRUE
8590,Ss_30_40_34_70,30,40,34,70,Point-fixed structural glass soffit systems,TRUE
8600,Ss_30_40_50,30,40,50,,"Metal sheet, fully supported roof and dormer covering systems",TRUE
8610,Ss_30_40_50_05,30,40,50,05,Aluminium sheet dormer covering systems,TRUE
8620,Ss_30_40_50_10,30,40,50,10,Aluminium sheet fully supported roof covering systems,TRUE
8630,Ss_30_40_50_12,30,40,50,12,Carbon steel sheet dormer covering systems,TRUE
8640,Ss_30_40_50_13,30,40,50,13,Carbon steel sheet fully supported roof covering systems,TRUE
8650,Ss_30_40_50_15,30,40,50,15,Copper sheet dormer covering systems,TRUE
8660,Ss_30_40_50_20,30,40,50,20,Copper sheet fully supported roof covering systems,TRUE
8670,Ss_30_40_50_40,30,40,50,40,Lead sheet dormer covering systems,TRUE
8680,Ss_30_40_50_45,30,40,50,45,Lead sheet fully supported roof covering systems,TRUE
8690,Ss_30_40_50_50,30,40,50,50,Lead-wrapped panel systems,TRUE
8700,Ss_30_40_50_75,30,40,50,75,Stainless steel sheet dormer covering systems,TRUE
8710,Ss_30_40_50_80,30,40,50,80,Stainless steel sheet fully supported roof covering systems,TRUE
8720,Ss_30_40_50_90,30,40,50,90,Zinc sheet dormer covering systems,TRUE
8730,Ss_30_40_50_95,30,40,50,95,Zinc sheet fully supported roof covering systems,TRUE
8740,Ss_30_40_55,30,40,55,,Metal composite panel roof covering systems,TRUE
8750,Ss_30_40_55_10,30,40,55,10,Built up metal insulating sandwich panel roof systems,TRUE
8760,Ss_30_40_55_50,30,40,55,50,Metal composite panel roofing systems,TRUE
8770,Ss_30_40_55_54,30,40,55,54,Metal insulating sandwich panel roof systems,TRUE
8780,Ss_30_40_55_55,30,40,55,55,Metal semi-composite panel roofing systems,TRUE
8790,Ss_30_40_65,30,40,65,,Profiled sheet self-supporting roof covering systems,TRUE
8800,Ss_30_40_65_30,30,40,65,30,Fibre cement profiled self-supporting sheet roof covering systems,TRUE
8810,Ss_30_40_65_50,30,40,65,50,Metal profiled sheet self-supporting roof covering systems,TRUE
8820,Ss_30_40_65_60,30,40,65,60,Plastics profiled sheet self-supporting roof covering systems,TRUE
8830,Ss_30_40_90,30,40,90,,Tensile fabric roofing systems,TRUE
8840,Ss_30_40_90_40,30,40,90,40,Internal single layer tensile fabric roofing systems,TRUE
8850,Ss_30_40_90_50,30,40,90,50,Multilayer tensile fabric roofing systems,TRUE
8860,Ss_30_40_90_75,30,40,90,75,Single layer tensile fabric roofing systems,TRUE
8870,Ss_30_40_92,30,40,92,,Thatch roof covering systems,TRUE
8880,Ss_30_40_92_85,30,40,92,85,Thatch roofing systems,TRUE
8890,Ss_30_40_95,30,40,95,,Unit roofing systems,TRUE
8900,Ss_30_40_95_10,30,40,95,10,Bitumen membrane shingle roofing systems,TRUE
8910,Ss_30_40_95_15,30,40,95,15,Ceramic slate roofing systems,TRUE
8920,Ss_30_40_95_30,30,40,95,30,Fibre cement slate roofing systems,TRUE
8930,Ss_30_40_95_40,30,40,95,40,Interlocking tile roofing systems,TRUE
8940,Ss_30_40_95_50,30,40,95,50,Metal tile roofing systems,TRUE
8950,Ss_30_40_95_55,30,40,95,55,Natural slate roofing systems,TRUE
8960,Ss_30_40_95_60,30,40,95,60,Natural stone slate roofing systems,TRUE
8970,Ss_30_40_95_65,30,40,95,65,Plain tile roofing systems,TRUE
8980,Ss_30_40_95_70,30,40,95,70,Reconstituted slate roofing systems,TRUE
8990,Ss_30_40_95_74,30,40,95,74,Roofing edges and junction systems,TRUE
9000,Ss_30_40_95_95,30,40,95,95,Wood shake or shingle roofing systems,TRUE
9010,Ss_30_42,30,42,,,Floor covering and finishing systems,TRUE
9020,Ss_30_42_10,30,42,10,,Calcium sulfate-based screed systems,TRUE
9030,Ss_30_42_10_10,30,42,10,10,Bonded calcium sulfate-based screed systems,TRUE
9040,Ss_30_42_10_30,30,42,10,30,Floating calcium sulfate-based screed systems,TRUE
9050,Ss_30_42_10_90,30,42,10,90,Unbonded calcium sulfate-based screed systems,TRUE
9060,Ss_30_42_15,30,42,15,,Cementitious screed systems,TRUE
9070,Ss_30_42_15_10,30,42,15,10,Bonded or partially bonded cementitious levelling screed systems,TRUE
9080,Ss_30_42_15_15,30,42,15,15,Cementitious wearing screed systems,TRUE
9090,Ss_30_42_15_30,30,42,15,30,Floating cementitious levelling screed systems,TRUE
9100,Ss_30_42_15_90,30,42,15,90,Unbonded cementitious levelling screed systems,TRUE
9110,Ss_30_42_20,30,42,20,,Deck covering systems,TRUE
9120,Ss_30_42_30,30,42,30,,Floor paint systems,TRUE
9130,Ss_30_42_30_30,30,42,30,30,Floor coating systems,TRUE
9140,Ss_30_42_32,30,42,32,,Floor tiling systems,TRUE
9150,Ss_30_42_32_30,30,42,32,30,External floor tiling systems,TRUE
9160,Ss_30_42_32_40,30,42,32,40,Internal floor tiling systems,TRUE
9170,Ss_30_42_40,30,42,40,,Ice rink floor systems,TRUE
9180,Ss_30_42_52,30,42,52,,Mastic asphalt flooring and floor underlay systems,TRUE
9190,Ss_30_42_52_50,30,42,52,50,Mastic asphalt flooring systems,TRUE
9200,Ss_30_42_52_52,30,42,52,52,Mastic asphalt floor underlay systems,TRUE
9210,Ss_30_42_54,30,42,54,,Monolithic flooring systems,TRUE
9220,Ss_30_42_54_75,30,42,54,75,Resin flooring systems,TRUE
9230,Ss_30_42_56,30,42,56,,Natural stone flooring systems,TRUE
9240,Ss_30_42_56_56,30,42,56,56,Natural stone slab flooring systems,TRUE
9250,Ss_30_42_56_57,30,42,56,57,Natural stone tile flooring systems,TRUE
9260,Ss_30_42_72,30,42,72,,Resilient and textile floor covering systems,TRUE
9270,Ss_30_42_72_05,30,42,72,05,Adhesive-fixed rolled carpet systems,TRUE
9280,Ss_30_42_72_10,30,42,72,10,Carpet tile systems,TRUE
9290,Ss_30_42_72_25,30,42,72,25,Edge-fixed carpet systems,TRUE
9300,Ss_30_42_72_72,30,42,72,72,Resilient sheet floor covering systems,TRUE
9310,Ss_30_42_72_75,30,42,72,75,Resilient tile floor covering systems,TRUE
9320,Ss_30_42_90,30,42,90,,Terrazzo floor tiling and screed systems,TRUE
9330,Ss_30_42_90_90,30,42,90,90,Terrazzo floor covering systems,TRUE
9340,Ss_30_45,30,45,,,Pavement covering and finishing systems,TRUE
9350,Ss_30_47,30,47,,,Ceiling and soffit covering and finishing systems,TRUE
9360,Ss_30_60,30,60,,,"Roof, floor and paving accessory systems",TRUE
9370,Ss_30_60_30,30,60,30,,Floor feature systems,TRUE
9380,Ss_30_60_30_26,30,60,30,26,Entrance matting systems,TRUE
9390,Ss_30_60_45,30,60,45,,Kerb and traffic separation systems,TRUE
9400,Ss_30_60_45_03,30,60,45,03,Asphalt kerb systems,TRUE
9410,Ss_30_60_45_15,30,60,45,15,Concrete kerb systems,TRUE
9420,Ss_30_60_45_20,30,60,45,20,Demarcation paving systems,TRUE
9430,Ss_30_60_45_45,30,60,45,45,Light-duty kerb systems,TRUE
9440,Ss_30_60_45_55,30,60,45,55,Multi unit traffic calming systems,TRUE
9450,Ss_30_60_45_65,30,60,45,65,Precast kerb systems,TRUE
9460,Ss_30_60_45_80,30,60,45,80,Single unit traffic calming systems,TRUE
9470,Ss_30_60_45_85,30,60,45,85,Traffic kerb systems,TRUE
9480,Ss_30_60_45_86,30,60,45,86,Traffic separation systems,TRUE
9490,Ss_30_60_70,30,60,70,,Roof feature systems,TRUE
9500,Ss_30_75,30,75,,,"Roof, floor and paving drainage systems",TRUE
9510,Ss_30_75_40,30,75,40,,Surface drainage channel systems,TRUE
9520,Ss_30_75_40_30,30,75,40,30,Footway grating systems,TRUE
9530,Ss_30_75_40_50,30,75,40,50,Multi unit surface drainage channel systems,TRUE
9540,Ss_30_75_40_75,30,75,40,75,Single unit surface drainage channel systems,TRUE
9550,Ss_30_75_50,30,75,50,,Metal sheet gutter lining systems,TRUE
9560,Ss_30_75_50_05,30,75,50,05,Aluminium sheet gutter lining systems,TRUE
9570,Ss_30_75_50_11,30,75,50,11,Carbon steel sheet gutter lining systems,TRUE
9580,Ss_30_75_50_15,30,75,50,15,Copper sheet gutter lining systems,TRUE
9590,Ss_30_75_50_45,30,75,50,45,Lead sheet gutter lining systems,TRUE
9600,Ss_30_75_50_75,30,75,50,75,Stainless steel sheet gutter lining systems,TRUE
9610,Ss_30_75_50_95,30,75,50,95,Zinc sheet gutter lining systems,TRUE
9620,Ss_30_95,30,95,,,"Temporary roof, floor and paving systems",TRUE
9630,Ss_32,32,,,,"Damp-proofing, waterproofing and plaster-finishing systems",TRUE
9640,Ss_32_20,32,20,,,Damp-proofing systems,TRUE
9650,Ss_32_20_20,32,20,20,,Damp-proof course renewal and insertion systems,TRUE
9660,Ss_32_20_20_15,32,20,20,15,Chemical injection damp-proof course systems,TRUE
9670,Ss_32_20_20_47,32,20,20,47,Lead damp-proof course systems,TRUE
9680,Ss_32_20_20_62,32,20,20,62,Physical insertion horizontal damp-proof course systems,TRUE
9690,Ss_32_20_20_63,32,20,20,63,Physical insertion horizontal or stepped cavity tray systems,TRUE
9700,Ss_32_20_20_64,32,20,20,64,Physical insertion proprietary rising damp remedial systems,TRUE
9710,Ss_32_20_20_65,32,20,20,65,Physical insertion vertical damp-proof course systems,TRUE
9720,Ss_32_20_30,32,20,30,,Floor damp-proofing systems,TRUE
9730,Ss_32_20_30_10,32,20,30,10,Cementitious mortar slurry floor damp-proofing systems,TRUE
9740,Ss_32_20_30_15,32,20,30,15,Cold-applied liquid floor damp-proofing systems,TRUE
9750,Ss_32_20_30_30,32,20,30,30,Fully bonded bitumen membrane overslab damp-proofing systems,TRUE
9760,Ss_32_20_30_35,32,20,30,35,Fully bonded bitumen membrane underslab damp-proofing systems,TRUE
9770,Ss_32_20_30_40,32,20,30,40,Hot-applied liquid floor damp-proofing systems,TRUE
9780,Ss_32_20_30_45,32,20,30,45,Loose-laid bitumen membrane overslab damp-proofing systems,TRUE
9790,Ss_32_20_30_46,32,20,30,46,Loose-laid bitumen membrane underslab damp-proofing systems,TRUE
9800,Ss_32_20_30_48,32,20,30,48,Loose-laid polyethylene membrane oversite damp-proofing systems,TRUE
9810,Ss_32_20_30_50,32,20,30,50,Loose-laid polyethylene membrane overslab damp-proofing systems,TRUE
9820,Ss_32_20_30_51,32,20,30,51,Loose-laid polyethylene membrane underslab damp-proofing systems,TRUE
9830,Ss_32_20_30_55,32,20,30,55,Mastic asphalt floor damp-proofing systems,TRUE
9840,Ss_32_20_30_60,32,20,30,60,Plastics studded membrane floor damp-proofing systems,TRUE
9850,Ss_32_20_30_65,32,20,30,65,Pre-applied anchored membrane underslab damp-proofing systems,TRUE
9860,Ss_32_20_30_75,32,20,30,75,Self-adhesive bitumen membrane floor damp-proofing systems,TRUE
9870,Ss_32_20_95,32,20,95,,Wall damp-proofing systems,TRUE
9880,Ss_32_20_95_10,32,20,95,10,Cementitious mortar slurry internal wall damp-proofing systems,TRUE
9890,Ss_32_20_95_15,32,20,95,15,Cold-applied liquid internal wall damp-proofing systems,TRUE
9900,Ss_32_20_95_65,32,20,95,65,Plastics studded membrane internal wall damp-proofing systems,TRUE
9910,Ss_32_30,32,30,,,Flashing and weathering systems,TRUE
9920,Ss_32_30_30,32,30,30,,Flashing systems,TRUE
9930,Ss_32_30_30_03,32,30,30,03,Aluminium flashing systems,TRUE
9940,Ss_32_30_30_11,32,30,30,11,Carbon steel flashing systems,TRUE
9950,Ss_32_30_30_14,32,30,30,14,Copper flashing systems,TRUE
9960,Ss_32_30_30_47,32,30,30,47,Lead flashing systems,TRUE
9970,Ss_32_30_30_84,32,30,30,84,Stainless steel flashing systems,TRUE
9980,Ss_32_30_30_98,32,30,30,98,Zinc flashing systems,TRUE
9990,Ss_32_30_90,32,30,90,,Weathering  systems,TRUE
10000,Ss_32_30_90_04,32,30,90,04,Aluminium weathering systems,TRUE
10010,Ss_32_30_90_12,32,30,90,12,Carbon steel weathering systems,TRUE
10020,Ss_32_30_90_15,32,30,90,15,Copper weathering systems,TRUE
10030,Ss_32_30_90_48,32,30,90,48,Lead weathering systems,TRUE
10040,Ss_32_30_90_85,32,30,90,85,Stainless steel weathering systems,TRUE
10050,Ss_32_30_90_99,32,30,90,99,Zinc weathering systems,TRUE
10060,Ss_32_46,32,46,,,Lath and plaster systems,TRUE
10070,Ss_32_46_50,32,46,50,,Metal lathing and anchored mesh reinforcement systems,TRUE
10080,Ss_32_46_50_05,32,46,50,05,Anchored mesh reinforcement systems,TRUE
10090,Ss_32_46_50_50,32,46,50,50,Metal lathing casing systems,TRUE
10100,Ss_32_46_50_51,32,46,50,51,Metal lathing on framing systems,TRUE
10110,Ss_32_46_50_52,32,46,50,52,"Metal lathing on hangers, bearers and runners systems",TRUE
10120,Ss_32_46_50_53,32,46,50,53,Metal lathing on solid substrate systems,TRUE
10130,Ss_32_46_65,32,46,65,,Plaster-coating systems,TRUE
10140,Ss_32_46_65_15,32,46,65,15,Clay plaster systems,TRUE
10150,Ss_32_46_65_55,32,46,65,55,Multicoat plaster systems,TRUE
10160,Ss_32_46_65_58,32,46,65,58,One-coat plaster systems,TRUE
10170,Ss_32_46_65_90,32,46,65,90,Tiling and mosaic plaster substrate systems,TRUE
10180,Ss_32_80,32,80,,,Waterproofing and tanking systems,TRUE
10190,Ss_32_80_03,32,80,03,,Applied waterproofing and tanking systems,TRUE
10200,Ss_32_80_03_08,32,80,03,08,Bridge deck liquid sprayed systems,TRUE
10210,Ss_32_80_03_10,32,80,03,10,Cementitious proprietary mortar slurry tanking systems,TRUE
10220,Ss_32_80_03_12,32,80,03,12,Cementitious site-batched-and-mixed mortar tanking systems,TRUE
10230,Ss_32_80_03_14,32,80,03,14,Cold-applied liquid waterproofing systems,TRUE
10240,Ss_32_80_03_16,32,80,03,16,Cold-applied liquid sandwiched tanking systems,TRUE
10250,Ss_32_80_03_18,32,80,03,18,Crystallization-active cementitious mortar dry shake tanking systems,TRUE
10260,Ss_32_80_03_20,32,80,03,20,Crystallization-active cementitious mortar slurry tanking systems,TRUE
10270,Ss_32_80_03_50,32,80,03,50,Mastic asphalt external tanking systems,TRUE
10280,Ss_32_80_03_52,32,80,03,52,Mastic asphalt sandwiched tanking systems,TRUE
10290,Ss_32_80_03_54,32,80,03,54,Mastic asphalt tank lining systems,TRUE
10300,Ss_32_80_03_90,32,80,03,90,Tunnel spray-applied membrane systems,TRUE
10310,Ss_32_80_79,32,80,79,,Sheeted waterproofing and tanking systems,TRUE
10320,Ss_32_80_79_08,32,80,79,08,Bridge deck sheet systems,TRUE
10330,Ss_32_80_79_30,32,80,79,30,Fully bonded bitumen membrane external tanking systems,TRUE
10340,Ss_32_80_79_32,32,80,79,32,Fully bonded bitumen membrane sandwiched tanking systems,TRUE
10350,Ss_32_80_79_33,32,80,79,33,Fully bonded flexible sheet membrane waterproofing systems,TRUE
10360,Ss_32_80_79_36,32,80,79,36,Hard rigid plastics sheet membrane waterproofing systems,TRUE
10370,Ss_32_80_79_40,32,80,79,40,High-density plastics studded membrane cavity drain waterproofing systems,TRUE
10380,Ss_32_80_79_45,32,80,79,45,Loose-laid bentonite membrane external or sandwiched tanking systems,TRUE
10390,Ss_32_80_79_75,32,80,79,75,Self-adhesive bitumen membrane external tanking systems,TRUE
10400,Ss_32_80_79_77,32,80,79,77,Self-adhesive bitumen membrane sandwiched tanking systems,TRUE
10410,Ss_32_80_79_84,32,80,79,84,Steel membrane waterproofing systems,TRUE
10420,Ss_32_80_79_86,32,80,79,86,Structure-supported sheet membrane waterproofing systems,TRUE
10430,Ss_32_80_79_90,32,80,79,90,Tunnel sheet membrane systems,TRUE
10440,Ss_32_80_79_92,32,80,79,92,Unbonded flexible sheet membrane waterproofing systems,TRUE
10450,Ss_32_80_90,32,80,90,,Water feature and pond sheet lining systems,TRUE
10460,Ss_32_80_90_35,32,80,90,35,Ground-supported water retention sheet lining systems,TRUE
10470,Ss_32_80_90_85,32,80,90,85,Structure-supported water retention sheet lining systems,TRUE
10480,Ss_35,35,,,,Stair and ramp systems,TRUE
10490,Ss_35_10,35,10,,,Stair and ramp structure systems,TRUE
10500,Ss_35_10_25,35,10,25,,External stair and ramp systems,TRUE
10510,Ss_35_10_25_34,35,10,25,34,Ground bearing external ramp systems,TRUE
10520,Ss_35_10_25_35,35,10,25,35,Ground bearing external stair systems,TRUE
10530,Ss_35_10_25_83,35,10,25,83,Suspended external ramp systems,TRUE
10540,Ss_35_10_25_85,35,10,25,85,Suspended external stair systems,TRUE
10550,Ss_35_10_30,35,10,30,,Fixed utilitarian access systems,TRUE
10560,Ss_35_10_30_15,35,10,30,15,Companionway ladder systems,TRUE
10570,Ss_35_10_30_40,35,10,30,40,Industrial stair systems,TRUE
10580,Ss_35_10_30_60,35,10,30,60,Permanently-fixed roof ladder systems,TRUE
10590,Ss_35_10_30_62,35,10,30,62,Permanently-fixed vertical ladder systems,TRUE
10600,Ss_35_10_30_95,35,10,30,95,Working platform and walkway systems,TRUE
10610,Ss_35_10_40,35,10,40,,Internal stair and ramp systems,TRUE
10620,Ss_35_10_40_20,35,10,40,20,Curved internal stair systems,TRUE
10630,Ss_35_10_40_40,35,10,40,40,Internal ramp systems,TRUE
10640,Ss_35_10_40_42,35,10,40,42,Internal stair systems,TRUE
10650,Ss_35_10_40_84,35,10,40,84,Straight internal stair systems,TRUE
10660,Ss_35_10_50,35,10,50,,Marine and waterside ramp systems,TRUE
10670,Ss_35_10_50_29,35,10,50,29,Fixed ramp systems,TRUE
10680,Ss_35_10_50_31,35,10,50,31,Floating pontoon ramp systems,TRUE
10690,Ss_35_10_50_42,35,10,50,42,Integral pontoon ramp systems,TRUE
10700,Ss_35_10_85,35,10,85,,Structural stair and ramp systems,TRUE
10710,Ss_35_10_85_15,35,10,85,15,Concrete stair or ramp systems,TRUE
10720,Ss_35_10_85_35,35,10,85,35,Heavy steel stair or ramp systems,TRUE
10730,Ss_35_10_85_65,35,10,85,65,Precast concrete stair or ramp systems,TRUE
10740,Ss_35_10_85_90,35,10,85,90,Timber stair or ramp systems,TRUE
10750,Ss_35_30,35,30,,,Stair and ramp opening systems,TRUE
10760,Ss_35_30_15,35,30,15,,Concrete stair and ramp glazing systems,TRUE
10770,Ss_35_30_15_15,35,30,15,15,Concrete stair tread glazing systems,TRUE
10780,Ss_35_40,35,40,,,Stair and ramp covering and finishing systems,TRUE
10790,Ss_35_40_82,35,40,82,,Stair carpeting systems,TRUE
10800,Ss_35_40_82_05,35,40,82,05,Adhesive-fixed stair carpeting systems,TRUE
10810,Ss_35_95,35,95,,,Temporary stair and ramp systems,TRUE
10820,Ss_37,37,,,,"Tunnel, shaft, vessel and tower systems",TRUE
10830,Ss_37_14,37,14,,,Chute systems,TRUE
10840,Ss_37_14_10,37,14,10,,Bulk material chute systems,TRUE
10850,Ss_37_14_25,37,14,25,,Escape chute systems,TRUE
10860,Ss_37_14_70,37,14,70,,Refuse and linen chute systems,TRUE
10870,Ss_37_14_70_08,37,14,70,08,Built-in linen chute systems,TRUE
10880,Ss_37_14_70_10,37,14,70,10,Built-in refuse chute systems,TRUE
10890,Ss_37_14_70_63,37,14,70,63,Post-fixed linen chute systems,TRUE
10900,Ss_37_14_70_65,37,14,70,65,Post-fixed refuse chute systems,TRUE
10910,Ss_37_16,37,16,,,Vessel and trench systems,TRUE
10920,Ss_37_16_02,37,16,02,,Above-ground pool systems,TRUE
10930,Ss_37_16_05,37,16,05,,Basement water-retaining systems,TRUE
10940,Ss_37_16_10,37,16,10,,Bund systems,TRUE
10950,Ss_37_16_10_32,37,16,10,32,Fuel tank bund systems,TRUE
10960,Ss_37_16_10_90,37,16,10,90,Transformer bund systems,TRUE
10970,Ss_37_16_50,37,16,50,,Metal and plastics water-retaining systems,TRUE
10980,Ss_37_16_65,37,16,65,,Pond and wetland systems,TRUE
10990,Ss_37_16_65_40,37,16,65,40,Informal pond systems,TRUE
11000,Ss_37_16_65_70,37,16,65,70,Raised formal pond systems,TRUE
11010,Ss_37_16_65_85,37,16,65,85,Submerged formal pond systems,TRUE
11020,Ss_37_16_65_95,37,16,65,95,Wetland systems,TRUE
11030,Ss_37_16_75,37,16,75,,Silo systems,TRUE
